,Unnamed: 0,user,question,question_class,answer_v1,answer_v2,v1_x_v2
1277,1277,162,What is structural testing..,whQuestion,"Structural testing (or White-Box testing) is a technique in which tests are derived from the knowledge of the software's structure or internal implementation. That way, the testing professional is able to check if a specific part of the code is correct. Unit testing is an instance of structural testing.","Structural testing (or White-Box testing) is a technique in which tests are derived from the knowledge of the software's structure or internal implementation. That way, the testing professional is able to check if a specific part of the code is correct. Unit testing is an instance of structural testing.",1.000000238418579
1278,1278,162,What is functional testing,whQuestion,"Functional testing (or Black Box Testing) is a technique whereby the system is tested against the functional requirements/specifications. During the functional testing the internal logic of the system being tested is not known to the tester. Functional testing ensures that the requirements are properly satisfied by the system. This type of testing is not concerned with how processing occurs, but rather, with the results of processing. It simulates actual system usage but does not make any system structure assumptions. Functional testing is normally performed during the levels of System Testing and Acceptance Testing.","Functional testing (or Black Box Testing) is a technique whereby the system is tested against the functional requirements/specifications. During the functional testing the internal logic of the system being tested is not known to the tester. Functional testing ensures that the requirements are properly satisfied by the system. This type of testing is not concerned with how processing occurs, but rather, with the results of processing. It simulates actual system usage but does not make any system structure assumptions. Functional testing is normally performed during the levels of System Testing and Acceptance Testing.",0.9999998807907104
1279,1279,162,What is a Test Drive,whQuestion,"Sorry, I still can't answer that.. Could you ask me differently?",I don't understand what you mean,0.32585859298706055
1280,1280,162,What is a Unit Test,whQuestion,"A test, in software testing, is the act of performing some assurance of both the correctness of a software and its validation of the project requisistes.","A test, in software testing, is the act of performing some assurance of both the correctness of a software and its validation of the project requisistes.",1.0
1281,1281,162,what is unit testing,whQuestion,"Unit testing verifies the functioning in isolation of software elements that are separately testable. Depending on the context, these could be the individual subprograms or a larger component made of highly cohesive units. Typically, unit testing occurs with access to the code being tested and with the support of supporting tools. The programmers who wrote the code typically, but not always, conduct unit testing.","Unit testing verifies the functioning in isolation of software elements that are separately testable. Depending on the context, these could be the individual subprograms or a larger component made of highly cohesive units. Typically, unit testing occurs with access to the code being tested and with the support of supporting tools. The programmers who wrote the code typically, but not always, conduct unit testing.",1.000000238418579
1282,1282,162,what is integration testing,whQuestion,"Integration testing is the process of verifying the interactions among software components. Classical integration testing strategies, such as top-down and bottom-up, are often used with hierarchically structured software.","Integration testing is the process of verifying the interactions among software components. Classical integration testing strategies, such as top-down and bottom-up, are often used with hierarchically structured software.",0.9999998807907104
1283,1283,162,what is equivalence partitioning,whQuestion,"Equivalence partitioning is a functional testing criterion that involves partitioning the input domain into a collection of subsets (or equivalent classes). Data in each partition must behave the same way therefore only one condition needs to be tested. Similarly, if one condition in a partition doesn’t work, then none of the others will work.","Equivalence partitioning is a functional testing criterion that involves partitioning the input domain into a collection of subsets (or equivalent classes). Data in each partition must behave the same way therefore only one condition needs to be tested. Similarly, if one condition in a partition doesn’t work, then none of the others will work.",1.0000001192092896
1284,1284,163,hi,Greet,Welcome!,Hi,0.13563869893550873
1285,1285,163,how many phases are in software testing,whQuestion,"Sorry, I still can't answer that.. Could you ask me differently?","Software testing is an activity of software engineering whose main goal is to validate the project requisites and to assert the software correctness, both before the deployment of the final product as well as during its maintenance.",-0.030446060001850128
1286,1286,163,phases of software testing,Statement,"Sorry, I still can't answer that.. Could you ask me differently?","Software testing is an activity of software engineering whose main goal is to validate the project requisites and to assert the software correctness, both before the deployment of the final product as well as during its maintenance.",-0.030446060001850128
1287,1287,163,software testing phases,Statement,"Sorry, I still can't answer that.. Could you ask me differently?","Sorry, I didn't understand your question, could you repeat?",0.5751727223396301
1288,1288,163,software testing,Statement,"Sorry, I still can't answer that.. Could you ask me differently?","Software testing is an activity of software engineering whose main goal is to validate the project requisites and to assert the software correctness, both before the deployment of the final product as well as during its maintenance.",-0.030446060001850128
1289,1289,163,what is software testing,whQuestion,"Software testing is an activity of software engineering whose main goal is to validate the project requisites and to assert the software correctness, both before the deployment of the final product as well as during its maintenaice.","Software testing is an activity of software engineering whose main goal is to validate the project requisites and to assert the software correctness, both before the deployment of the final product as well as during its maintenance.",0.9988222718238831
1290,1290,163,what are software testing phases,whQuestion,"Sorry, I still can't answer that.. Could you ask me differently?","Sorry, I didn't quite catch that",0.26980283856391907
1291,1291,163,what is equivalence partitioning,whQuestion,"Equivalence partitioning is a functional testing criterion that involves partitioning the input domain into a collection of subsets (or equivalent classes). Data in each partition must behave the same way therefore only one condition needs to be tested. Similarly, if one condition in a partition doesn’t work, then none of the others will work.","Equivalence partitioning is a functional testing criterion that involves partitioning the input domain into a collection of subsets (or equivalent classes). Data in each partition must behave the same way therefore only one condition needs to be tested. Similarly, if one condition in a partition doesn’t work, then none of the others will work.",1.0000001192092896
1292,1292,164,Hi,Greet,"Hello, how are you?",Hi,0.6183379888534546
1293,1293,164,"Hello, i am fine and you",Statement,Welcome!,Hi,0.13563869893550873
1294,1294,164,How are you,whQuestion,Great! How are you?,"Sorry, I didn't quite catch that",-0.051656920462846756
1295,1295,164,I Am fine,Statement,"Sorry, I still can't answer that.. Could you ask me differently?","Sorry, I didn't quite catch that",0.26980283856391907
1296,1296,164,I am fine,Statement,"Sorry, I still can't answer that.. Could you ask me differently?","Sorry, I didn't quite catch that",0.26980283856391907
1297,1297,164,No,nAnswer,"Sorry, I still can't answer that.. Could you ask me differently?",Hi,0.11770277470350266
1298,1298,164,How are you,whQuestion,"I am fine, what about you",I don't understand what you mean,0.0380149707198143
1299,1299,164,I am fine,Statement,"Sorry, I still can't answer that.. Could you ask me differently?",I don't understand what you mean,0.32585859298706055
1300,1300,164,How are you feeling,whQuestion,Great! How are you?,"Sorry, I didn't quite catch that",-0.051656920462846756
1301,1301,164,I am feeling afraid,yAnswer,"Sorry, I still can't answer that.. Could you ask me differently?",I don't understand what you mean,0.32585859298706055
1302,1302,164,What do you like,whQuestion,"Sorry, I still can't answer that.. Could you ask me differently?","Sorry, I didn't understand your question, could you repeat?",0.5751727223396301
1303,1303,164,Hey,Greet,"Hello, how are you?",Hi,0.6183379888534546
1304,1304,164,You have a bug,Reject,"Sorry, I still can't answer that.. Could you ask me differently?","Fault is an incorrect step, process, or data definition in computer program. Fault is the formal name of a bug. A software defect or bug is a condition in a software product which doesn’t meet a software requirement or end-user expectation.",0.05178535357117653
1305,1305,164,Inspecion,Statement,"Sorry, I still can't answer that.. Could you ask me differently?",Hi,0.11770277470350266
1306,1306,164,What is your profession,whQuestion,"Sorry, I still can't answer that.. Could you ask me differently?",I don't understand what you mean,0.32585859298706055
1307,1307,164,What is your profession,whQuestion,"Sorry, I still can't answer that.. Could you ask me differently?","Sorry, I didn't quite catch that",0.26980283856391907
1308,1308,164,Can you give me a example of equivalence class partitioning criteria,ynQuestion,"Sorry, I still can't answer that.. Could you ask me differently?",I don't understand what you mean,0.32585859298706055
1309,1309,164,What is a fault,whQuestion,"Fault is an incorrect step, process, or data definition in computer program. Fault is the formal name of a bug.","Fault is an incorrect step, process, or data definition in computer program. Fault is the formal name of a bug. A software defect or bug is a condition in a software product which doesn’t meet a software requirement or end-user expectation.",0.9519746899604797
1310,1310,165,Hello,Greet,"Hello, ask me a question!",Hi,0.556562602519989
1311,1311,165,What is a fall,whQuestion,"Sorry, I still can't answer that.. Could you ask me differently?","Sorry, I didn't understand your question, could you repeat?",0.5751727223396301
1312,1312,165,What is a Fault,whQuestion,"Fault is an incorrect step, process, or data definition in computer program. Fault is the formal name of a bug.","Fault is an incorrect step, process, or data definition in computer program. Fault is the formal name of a bug. A software defect or bug is a condition in a software product which doesn’t meet a software requirement or end-user expectation.",0.9519746899604797
1313,1313,165,what is a software error,whQuestion,An error is a state of execution of the program which is not expected and may lead to an incorrect result.,An error is a state of execution of the program which is not expected and may lead to an incorrect result.,1.0000001192092896
1314,1314,165,what is a difference of fault and error,whQuestion,An error is a state of execution of the program which is not expected and may lead to an incorrect result.,An error is a state of execution of the program which is not expected and may lead to an incorrect result.,1.0000001192092896
1315,1315,165,software testing,Statement,"Sorry, I still can't answer that.. Could you ask me differently?","Software testing is an activity of software engineering whose main goal is to validate the project requisites and to assert the software correctness, both before the deployment of the final product as well as during its maintenance.",-0.030446060001850128
1316,1316,165,what is a software test,whQuestion,"A test, in software testing, is the act of performing some assurance of both the correctness of a software and its validation of the project requisistes.","A test, in software testing, is the act of performing some assurance of both the correctness of a software and its validation of the project requisistes.",1.0
1317,1317,165,software failure,Statement,"Sorry, I still can't answer that.. Could you ask me differently?",A failure is a result of the program which is incorrect or not expected. This is caused by an error.,0.14011836051940918
1318,1318,165,what is a software failure,whQuestion,A failure is a result of the program which is incorrect or not expected. This is caused by an error.,A failure is a result of the program which is incorrect or not expected. This is caused by an error.,1.0
1319,1319,165,what is a structural testing,whQuestion,"Structural testing (or White-Box testing) is a technique in which tests are derived from the knowledge of the software's structure or internal implementation. That way, the testing professional is able to check if a specific part of the code is correct. Unit testing is an instance of structural testing.","Structural testing (or White-Box testing) is a technique in which tests are derived from the knowledge of the software's structure or internal implementation. That way, the testing professional is able to check if a specific part of the code is correct. Unit testing is an instance of structural testing.",1.000000238418579
1320,1320,165,what is a functional testing,whQuestion,"Functional testing (or Black Box Testing) is a technique whereby the system is tested against the functional requirements/specifications. During the functional testing the internal logic of the system being tested is not known to the tester. Functional testing ensures that the requirements are properly satisfied by the system. This type of testing is not concerned with how processing occurs, but rather, with the results of processing. It simulates actual system usage but does not make any system structure assumptions. Functional testing is normally performed during the levels of System Testing and Acceptance Testing.","Functional testing (or Black Box Testing) is a technique whereby the system is tested against the functional requirements/specifications. During the functional testing the internal logic of the system being tested is not known to the tester. Functional testing ensures that the requirements are properly satisfied by the system. This type of testing is not concerned with how processing occurs, but rather, with the results of processing. It simulates actual system usage but does not make any system structure assumptions. Functional testing is normally performed during the levels of System Testing and Acceptance Testing.",0.9999998807907104
1321,1321,165,what is an unit testing,whQuestion,"Unit testing verifies the functioning in isolation of software elements that are separately testable. Depending on the context, these could be the individual subprograms or a larger component made of highly cohesive units. Typically, unit testing occurs with access to the code being tested and with the support of supporting tools. The programmers who wrote the code typically, but not always, conduct unit testing.","Unit testing verifies the functioning in isolation of software elements that are separately testable. Depending on the context, these could be the individual subprograms or a larger component made of highly cohesive units. Typically, unit testing occurs with access to the code being tested and with the support of supporting tools. The programmers who wrote the code typically, but not always, conduct unit testing.",1.000000238418579
1322,1322,165,what is an integration testing,whQuestion,"Integration testing is the process of verifying the interactions among software components. Classical integration testing strategies, such as top-down and bottom-up, are often used with hierarchically structured software.","Integration testing is the process of verifying the interactions among software components. Classical integration testing strategies, such as top-down and bottom-up, are often used with hierarchically structured software.",0.9999998807907104
1323,1323,166,What is a test case,whQuestion,"A test case is composed by the test input, the execution conditions and the expected output to be produced by the program.","A test case is composed by the test input, the execution conditions and the expected output to be produced by the program.",1.0000001192092896
1324,1324,166,What is the difference between an error and a mistake,Clarify,"An error is a state of execution of the program which is not expected and may lead to an incorrect result. A mistake is a human action that inserts a fault (or defect) into the source code, for instance, a typo is a mistake.","A mistake is a human action that inserts a fault (or defect) into the source code, for instance, a typo is a mistake.",0.8313653469085693
1325,1325,166,What kind of information is used in functional testing,whQuestion,"The functional (or black-box) testing requires the specification of the product, and only that. With this document, the test data can be created, and once the implementation of the program is complete, the testing activity can begin.","Functional testing (or Black Box Testing) is a technique whereby the system is tested against the functional requirements/specifications. During the functional testing the internal logic of the system being tested is not known to the tester. Functional testing ensures that the requirements are properly satisfied by the system. This type of testing is not concerned with how processing occurs, but rather, with the results of processing. It simulates actual system usage but does not make any system structure assumptions. Functional testing is normally performed during the levels of System Testing and Acceptance Testing.",0.8217060565948486
1326,1326,166,How do I apply equivalence partitioning,whQuestion,"The equivalence partitioning criterion divides the input domain in several subsets (partitions) with no intersection and selects a test case for each partition. The idea is that each test case represents all input domain that partition class and, therefore, one test case for each class is enough for this testing criterion. The criterion considers valid and invalid equivalence classes. For example, you can separate invalid and valid inputs into two different subsets or classes.","The equivalence partitioning criterion divides the input domain in several subsets (partitions) with no intersection and selects a test case for each partition. The idea is that each test case represents all input domain that partition class and, therefore, one test case for each class is enough for this testing criterion. The criterion considers valid and invalid equivalence classes. For example, you can separate invalid and valid inputs into two different subsets or classes.",1.0
1327,1327,166,Comment on software testing activity,Statement,"Software testing is an activity of software engineering whose main goal is to validate the project requisites and to assert the software correctness, both before the deployment of the final product as well as during its maintenaice.","Sorry, I didn't understand your question, could you repeat?",0.006301205605268478
1328,1328,166,very,Statement,"Sorry, I still can't answer that.. Could you ask me differently?",Hi,0.11770277470350266
1329,1329,166,Give me an example of boundarie-value analysis,Statement,"Sorry, I still can't answer that.. Could you ask me differently?","Sorry, I didn't understand your question, could you repeat?",0.5751727223396301
1330,1330,166,Give me an example of boundarie value analysis,Statement,TOB-STT:,"Sorry, I didn't understand your question, could you repeat?",0.21659594774246216
1331,1331,166,Give me an example of limit value analysis,ynQuestion,"Suppose you have a program in which the user has to create a password with length between 6 and 12. So the test cases generated for this program, using the boundary value analysis technique, would be for passwords with lengths 5, 6, 12 and 13.",Suppose you have a program that grants access to a certain web page only if you are 18 years old or older. So a boundary value analysis criteria used for this program would generate test cases for age inputs of 17 and 18.,0.7441936731338501
1332,1332,166,Give me an example of limit value analysis,ynQuestion,TOB-STT:,Suppose you have a program that grants access to a certain web page only if you are 18 years old or older. So a boundary value analysis criteria used for this program would generate test cases for age inputs of 17 and 18.,0.019456982612609863
1333,1333,166,Give me an example of limit value analysis,ynQuestion,"Suppose you have a program in which the user has to create a password with length between 6 and 12. So the test cases generated for this program, using the boundary value analysis technique, would be for passwords with lengths 5, 6, 12 and 13.",Suppose you have a program that grants access to a certain web page only if you are 18 years old or older. So a boundary value analysis criteria used for this program would generate test cases for age inputs of 17 and 18.,0.7441936731338501
1334,1334,166,Give me an example of limit value analysis,ynQuestion,"Suppose you have a program in which the user has to create a password with length between 6 and 12. So the test cases generated for this program, using the boundary value analysis technique, would be for passwords with lengths 5, 6, 12 and 13.","Suppose you have a program in which the user has to create a password with length between 6 and 12. So the test cases generated for this program, using the boundary value analysis technique, would be for passwords with lengths 5, 6, 12 and 13.",1.0000001192092896
1335,1335,166,Give me an example of limit value analysis,ynQuestion,"Suppose you have a program in which the user has to create a password with length between 6 and 12. So the test cases generated for this program, using the boundary value analysis technique, would be for passwords with lengths 5, 6, 12 and 13.","Suppose you have a program in which the user has to create a password with length between 6 and 12. So the test cases generated for this program, using the boundary value analysis technique, would be for passwords with lengths 5, 6, 12 and 13.",1.0000001192092896
1336,1336,166,How do I apply limit value analysis,Clarify,"The boundary-value testing criterion determines the boundaries for input values and selects the extremes of the boundary to generate test cases. For instance, if a program's valid input is a positive number less than 10, then the following test cases will be selected in order to test the boundaries: 0, 1, -1, 10, 9 and 11.","The boundary-value testing criterion determines the boundaries for input values and selects the extremes of the boundary to generate test cases. For instance, if a program's valid input is a positive number less than 10, then the following test cases will be selected in order to test the boundaries: 0, 1, -1, 10, 9 and 11.",1.0
1337,1337,166,How do I apply equivalence partitioning,whQuestion,"The equivalence partitioning criterion divides the input domain in several subsets (partitions) with no intersection and selects a test case for each partition. The idea is that each test case represents all input domain that partition class and, therefore, one test case for each class is enough for this testing criterion. The criterion considers valid and invalid equivalence classes. For example, you can separate invalid and valid inputs into two different subsets or classes.","The equivalence partitioning criterion divides the input domain in several subsets (partitions) with no intersection and selects a test case for each partition. The idea is that each test case represents all input domain that partition class and, therefore, one test case for each class is enough for this testing criterion. The criterion considers valid and invalid equivalence classes. For example, you can separate invalid and valid inputs into two different subsets or classes.",1.0
1338,1338,166,How do I apply limit value partitioning,Clarify,"Sorry, I still can't answer that.. Could you ask me differently?",I don't understand what you mean,0.32585859298706055
1339,1339,166,How do I apply equivalence analysis,whQuestion,"Sorry, I still can't answer that.. Could you ask me differently?",I don't understand what you mean,0.32585859298706055
1340,1340,166,How do I apply limit value analysis,Clarify,"The boundary-value testing criterion determines the boundaries for input values and selects the extremes of the boundary to generate test cases. For instance, if a program's valid input is a positive number less than 10, then the following test cases will be selected in order to test the boundaries: 0, 1, -1, 10, 9 and 11.","The boundary-value testing criterion determines the boundaries for input values and selects the extremes of the boundary to generate test cases. For instance, if a program's valid input is a positive number less than 10, then the following test cases will be selected in order to test the boundaries: 0, 1, -1, 10, 9 and 11.",1.0
