,user,question,question_class,v1_answer,v2:model-20230626-203321
676,142,what is mutation testing,whQuestion,"Software testing is an activity of software engineering whose main goal is to validate the project requisites and to assert the software correctness, both before the deployment of the final product as well as during its maintenaice.","Sorry, I didn't understand your question, could you repeat?"
677,142,what is mutation,whQuestion,"Sorry, I still can't answer that.. Could you ask me differently?",I don't understand what you mean
678,142,what is black box,whQuestion,"Sorry, I still can't answer that.. Could you ask me differently?","Fault is an incorrect step, process, or data definition in computer program. Fault is the formal name of a bug. A software defect or bug is a condition in a software product which doesn’t meet a software requirement or end-user expectation."
679,142,can you give me an example of omission fault,Statement,"Suppose you have a program that, by the software requirements, should accept names with up to 20 digits, but the software developer reserved only 15 digits in the database. That is a defect in the software definition and can lead to an error.","Suppose you have a program that, by the software requirements, should accept names with up to 20 digits, but the software developer reserved only 15 digits in the database. That is a defect in the software definition and can lead to an error."
680,142,can you give me an example of incorrect fact,Statement,"Sorry, I still can't answer that.. Could you ask me differently?","Sorry, I didn't quite catch that"
681,142,can you give me an example of stranger Information,Emphasis,"Sorry, I still can't answer that.. Could you ask me differently?","Sorry, I didn't quite catch that"
682,142,what is a test case,whQuestion,"A test case is composed by the test input, the execution conditions and the expected output to be produced by the program.","A test case is composed by the test input, the execution conditions and the expected output to be produced by the program."
683,142,what is test data,whQuestion,The test data (or test input) is the input data and the parameters associated with a specified test case.,The test data (or test input) is the input data and the parameters associated with a specified test case.
684,142,what is test Domain,whQuestion,"Sorry, I still can't answer that.. Could you ask me differently?",I don't understand what you mean
685,142,what is input domain,whQuestion,The input domain is a set of values that can be used to execute a certain program. The input domain specifies all the possible sets of values.,The input domain is a set of values that can be used to execute a certain program. The input domain specifies all the possible sets of values.
686,142,what is inconsistent information,whQuestion,"Sorry, I still can't answer that.. Could you ask me differently?","Sorry, I didn't quite catch that"
687,142,can you give me an example of inconsistent information,Statement,"Sorry, I still can't answer that.. Could you ask me differently?","Sorry, I didn't understand your question, could you repeat?"
688,143,hi,Greet,Welcome!,Hi
689,143,tanks,Statement,"Sorry, I still can't answer that.. Could you ask me differently?",No worries!
690,143,hi,Greet,"Hi there, what do you need?",Hi
691,143,give me an example of omission,Statement,"Sorry, I still can't answer that.. Could you ask me differently?","Sorry, I didn't understand your question, could you repeat?"
692,143,examplo of emission,Statement,"Sorry, I still can't answer that.. Could you ask me differently?","Sorry, I didn't understand your question, could you repeat?"
693,143,Can you give me a example of omission,ynQuestion,"Sorry, I still can't answer that.. Could you ask me differently?","Sorry, I didn't quite catch that"
694,143,Can you give me a example of equivalence class partitioning criteria,ynQuestion,"Here is an example of an application of equivalence partitioning. Consider the following specification: one of the fields of a form is a text box that accepts numeric values from 18 to 25. For this problem, a value that belongs to an invalid equivalence class is 17, whereas a value belonging to a valid equivalence class is, for instance, 20.","Sorry, I didn't quite catch that"
695,143,Wkato is stranger information,yAnswer,"Sorry, I still can't answer that.. Could you ask me differently?",I don't understand what you mean
696,143,what is strange information,whQuestion,"Sorry, I still can't answer that.. Could you ask me differently?","Sorry, I didn't understand your question, could you repeat?"
697,143,what is structural testing,whQuestion,"Structural testing (or White-Box testing) is a technique in which tests are derived from the knowledge of the software's structure or internal implementation. That way, the testing professional is able to check if a specific part of the code is correct. Unit testing is an instance of structural testing.","Structural testing (or White-Box testing) is a technique in which tests are derived from the knowledge of the software's structure or internal implementation. That way, the testing professional is able to check if a specific part of the code is correct. Unit testing is an instance of structural testing."
698,143,what is functional testing,whQuestion,"Functional testing (or Black Box Testing) is a technique whereby the system is tested against the functional requirements/specifications. During the functional testing the internal logic of the system being tested is not known to the tester. Functional testing ensures that the requirements are properly satisfied by the system. This type of testing is not concerned with how processing occurs, but rather, with the results of processing. It simulates actual system usage but does not make any system structure assumptions. Functional testing is normally performed during the levels of System Testing and Acceptance Testing.","Functional testing (or Black Box Testing) is a technique whereby the system is tested against the functional requirements/specifications. During the functional testing the internal logic of the system being tested is not known to the tester. Functional testing ensures that the requirements are properly satisfied by the system. This type of testing is not concerned with how processing occurs, but rather, with the results of processing. It simulates actual system usage but does not make any system structure assumptions. Functional testing is normally performed during the levels of System Testing and Acceptance Testing."
699,143,what is unit testing,whQuestion,"Unit testing verifies the functioning in isolation of software elements that are separately testable. Depending on the context, these could be the individual subprograms or a larger component made of highly cohesive units. Typically, unit testing occurs with access to the code being tested and with the support of supporting tools. The programmers who wrote the code typically, but not always, conduct unit testing.","Unit testing verifies the functioning in isolation of software elements that are separately testable. Depending on the context, these could be the individual subprograms or a larger component made of highly cohesive units. Typically, unit testing occurs with access to the code being tested and with the support of supporting tools. The programmers who wrote the code typically, but not always, conduct unit testing."
700,143,what is integration testing,whQuestion,"Integration testing is the process of verifying the interactions among software components. Classical integration testing strategies, such as top-down and bottom-up, are often used with hierarchically structured software.","Integration testing is the process of verifying the interactions among software components. Classical integration testing strategies, such as top-down and bottom-up, are often used with hierarchically structured software."
701,143,what is test selection criterion,whQuestion,"Sorry, I still can't answer that.. Could you ask me differently?",I don't understand what you mean
702,143,what is selection test,whQuestion,"A test, in software testing, is the act of performing some assurance of both the correctness of a software and its validation of the project requisistes.","A test, in software testing, is the act of performing some assurance of both the correctness of a software and its validation of the project requisistes."
703,144,hi,Greet,Welcome!,Hi
704,144,pk,Statement,"Sorry, I still can't answer that.. Could you ask me differently?",Hi
705,144,ok,Statement,OK!,Bye!
706,144,ok,Statement,OK!,Bye!
707,144,What is a Software Fault,whQuestion,"Fault is an incorrect step, process, or data definition in computer program. Fault is the formal name of a bug.","Fault is an incorrect step, process, or data definition in computer program. Fault is the formal name of a bug. A software defect or bug is a condition in a software product which doesn’t meet a software requirement or end-user expectation."
708,144,What is a Software Error,whQuestion,An error is a state of execution of the program which is not expected and may lead to an incorrect result.,An error is a state of execution of the program which is not expected and may lead to an incorrect result.
709,144,What is a Software Failure,whQuestion,A failure is a result of the program which is incorrect or not expected. This is caused by an error.,A failure is a result of the program which is incorrect or not expected. This is caused by an error.
710,144,what are design mistakes,whQuestion,"Sorry, I still can't answer that.. Could you ask me differently?","Sorry, I didn't quite catch that"
711,144,what is a defect of omission,whQuestion,"Sorry, I still can't answer that.. Could you ask me differently?","Sorry, I didn't quite catch that"
712,144,What is inconsistency,whQuestion,"Sorry, I still can't answer that.. Could you ask me differently?","Sorry, I didn't quite catch that"
713,144,What is a test case,whQuestion,"A test case is composed by the test input, the execution conditions and the expected output to be produced by the program.","A test case is composed by the test input, the execution conditions and the expected output to be produced by the program."
714,144,what is Structural testing,whQuestion,"Structural testing (or White-Box testing) is a technique in which tests are derived from the knowledge of the software's structure or internal implementation. That way, the testing professional is able to check if a specific part of the code is correct. Unit testing is an instance of structural testing.","Structural testing (or White-Box testing) is a technique in which tests are derived from the knowledge of the software's structure or internal implementation. That way, the testing professional is able to check if a specific part of the code is correct. Unit testing is an instance of structural testing."
715,144,what is functional testing,whQuestion,"Functional testing (or Black Box Testing) is a technique whereby the system is tested against the functional requirements/specifications. During the functional testing the internal logic of the system being tested is not known to the tester. Functional testing ensures that the requirements are properly satisfied by the system. This type of testing is not concerned with how processing occurs, but rather, with the results of processing. It simulates actual system usage but does not make any system structure assumptions. Functional testing is normally performed during the levels of System Testing and Acceptance Testing.","Functional testing (or Black Box Testing) is a technique whereby the system is tested against the functional requirements/specifications. During the functional testing the internal logic of the system being tested is not known to the tester. Functional testing ensures that the requirements are properly satisfied by the system. This type of testing is not concerned with how processing occurs, but rather, with the results of processing. It simulates actual system usage but does not make any system structure assumptions. Functional testing is normally performed during the levels of System Testing and Acceptance Testing."
716,144,What are the stages of software testing,whQuestion,"Software testing is an activity of software engineering whose main goal is to validate the project requisites and to assert the software correctness, both before the deployment of the final product as well as during its maintenaice.","Software testing is an activity of software engineering whose main goal is to validate the project requisites and to assert the software correctness, both before the deployment of the final product as well as during its maintenance."
717,144,unit testing,Statement,"Sorry, I still can't answer that.. Could you ask me differently?","Unit testing verifies the functioning in isolation of software elements that are separately testable. Depending on the context, these could be the individual subprograms or a larger component made of highly cohesive units. Typically, unit testing occurs with access to the code being tested and with the support of supporting tools. The programmers who wrote the code typically, but not always, conduct unit testing."
718,144,what is unit testing,whQuestion,"Unit testing verifies the functioning in isolation of software elements that are separately testable. Depending on the context, these could be the individual subprograms or a larger component made of highly cohesive units. Typically, unit testing occurs with access to the code being tested and with the support of supporting tools. The programmers who wrote the code typically, but not always, conduct unit testing.","Unit testing verifies the functioning in isolation of software elements that are separately testable. Depending on the context, these could be the individual subprograms or a larger component made of highly cohesive units. Typically, unit testing occurs with access to the code being tested and with the support of supporting tools. The programmers who wrote the code typically, but not always, conduct unit testing."
719,144,what is integration testing,whQuestion,"Integration testing is the process of verifying the interactions among software components. Classical integration testing strategies, such as top-down and bottom-up, are often used with hierarchically structured software.","Integration testing is the process of verifying the interactions among software components. Classical integration testing strategies, such as top-down and bottom-up, are often used with hierarchically structured software."
720,144,what is test selection criterion,whQuestion,"Sorry, I still can't answer that.. Could you ask me differently?","Sorry, I didn't quite catch that"
721,145,hello,Greet,"Hello, how are you?",Hi
722,145,hi,Greet,Welcome!,Hi
723,145,hello,Greet,"Hi there, what do you need?",Hi
724,145,hello,Greet,"Hello, ask me a question!",Hi
725,145,what you can talk me about fault,whQuestion,"Sorry, I still can't answer that.. Could you ask me differently?","Fault is an incorrect step, process, or data definition in computer program. Fault is the formal name of a bug. A software defect or bug is a condition in a software product which doesn’t meet a software requirement or end-user expectation."
726,145,hello,Greet,"Hello, ask me a question!",Hi
727,145,what is the difference between error and fault,Clarify,"An error is a state of execution of the program which is not expected and may lead to an incorrect result. Fault is an incorrect step, process, or data definition in computer program. Fault is the formal name of a bug.","Fault is an incorrect step, process, or data definition in computer program. Fault is the formal name of a bug. A software defect or bug is a condition in a software product which doesn’t meet a software requirement or end-user expectation."
728,145,what is Omission fault,whQuestion,"Fault is an incorrect step, process, or data definition in computer program. Fault is the formal name of a bug.","Fault is an incorrect step, process, or data definition in computer program. Fault is the formal name of a bug. A software defect or bug is a condition in a software product which doesn’t meet a software requirement or end-user expectation."
729,145,What is incorrect fact,whQuestion,"Sorry, I still can't answer that.. Could you ask me differently?","Sorry, I didn't understand your question, could you repeat?"
730,145,what is a fault of incorrect fault,whQuestion,"Fault is an incorrect step, process, or data definition in computer program. Fault is the formal name of a bug.","Fault is an incorrect step, process, or data definition in computer program. Fault is the formal name of a bug. A software defect or bug is a condition in a software product which doesn’t meet a software requirement or end-user expectation."
731,145,give me an example of omission test,Statement,"Sorry, I still can't answer that.. Could you ask me differently?","Sorry, I didn't quite catch that"
732,145,give me a example of omission test,Statement,"Sorry, I still can't answer that.. Could you ask me differently?","Sorry, I didn't understand your question, could you repeat?"
733,145,what is software fault,whQuestion,"Fault is an incorrect step, process, or data definition in computer program. Fault is the formal name of a bug.","Fault is an incorrect step, process, or data definition in computer program. Fault is the formal name of a bug. A software defect or bug is a condition in a software product which doesn’t meet a software requirement or end-user expectation."
734,145,what is software error,whQuestion,An error is a state of execution of the program which is not expected and may lead to an incorrect result.,An error is a state of execution of the program which is not expected and may lead to an incorrect result.
735,145,what is software failure,whQuestion,A failure is a result of the program which is incorrect or not expected. This is caused by an error.,A failure is a result of the program which is incorrect or not expected. This is caused by an error.
736,145,what is incorrect fact,whQuestion,"Sorry, I still can't answer that.. Could you ask me differently?","Sorry, I didn't quite catch that"
737,145,what is software inspecion,whQuestion,"Sorry, I still can't answer that.. Could you ask me differently?","Sorry, I didn't understand your question, could you repeat?"
738,145,what is Omission defect,whQuestion,A software defect or bug is a condition in a software product which doesn’t meet a software requirement or end-user expectation.,"Fault is an incorrect step, process, or data definition in computer program. Fault is the formal name of a bug. A software defect or bug is a condition in a software product which doesn’t meet a software requirement or end-user expectation."
739,145,What is stranger information defect,Clarify,A software defect or bug is a condition in a software product which doesn’t meet a software requirement or end-user expectation.,"Fault is an incorrect step, process, or data definition in computer program. Fault is the formal name of a bug. A software defect or bug is a condition in a software product which doesn’t meet a software requirement or end-user expectation."
740,145,what is the name of the software defect,whQuestion,A software defect or bug is a condition in a software product which doesn’t meet a software requirement or end-user expectation.,"Fault is an incorrect step, process, or data definition in computer program. Fault is the formal name of a bug. A software defect or bug is a condition in a software product which doesn’t meet a software requirement or end-user expectation."
741,145,what is incosistence defect,whQuestion,A software defect or bug is a condition in a software product which doesn’t meet a software requirement or end-user expectation.,"Fault is an incorrect step, process, or data definition in computer program. Fault is the formal name of a bug. A software defect or bug is a condition in a software product which doesn’t meet a software requirement or end-user expectation."
742,145,incosistence,Statement,"Sorry, I still can't answer that.. Could you ask me differently?","Sorry, I didn't understand your question, could you repeat?"
743,145,what the types of software defects,whQuestion,"Sorry, I still can't answer that.. Could you ask me differently?","Sorry, I didn't understand your question, could you repeat?"
744,145,what is inconsistency defect,whQuestion,A software defect or bug is a condition in a software product which doesn’t meet a software requirement or end-user expectation.,"Fault is an incorrect step, process, or data definition in computer program. Fault is the formal name of a bug. A software defect or bug is a condition in a software product which doesn’t meet a software requirement or end-user expectation."
745,145,tell me about software defects,Statement,"Sorry, I still can't answer that.. Could you ask me differently?",I don't understand what you mean
746,145,what is software defect,whQuestion,A software defect or bug is a condition in a software product which doesn’t meet a software requirement or end-user expectation.,"Fault is an incorrect step, process, or data definition in computer program. Fault is the formal name of a bug. A software defect or bug is a condition in a software product which doesn’t meet a software requirement or end-user expectation."
747,145,what is software defect,whQuestion,A software defect or bug is a condition in a software product which doesn’t meet a software requirement or end-user expectation.,"Fault is an incorrect step, process, or data definition in computer program. Fault is the formal name of a bug. A software defect or bug is a condition in a software product which doesn’t meet a software requirement or end-user expectation."
748,145,what is software error,whQuestion,An error is a state of execution of the program which is not expected and may lead to an incorrect result.,An error is a state of execution of the program which is not expected and may lead to an incorrect result.
749,146,Hi,Greet,"Hello, ask me a question!",Hi
750,146,How old are you,ynQuestion,I am basically a child… But I know very much!,"Sorry, I didn't quite catch that"
751,146,DO you like anime,Statement,"Sorry, I still can't answer that.. Could you ask me differently?","Sorry, I didn't understand your question, could you repeat?"
752,146,What is the meaning of error,whQuestion,An error is a state of execution of the program which is not expected and may lead to an incorrect result.,An error is a state of execution of the program which is not expected and may lead to an incorrect result.
753,146,Who is your creator,whQuestion,"Sorry, I still can't answer that.. Could you ask me differently?",I don't understand what you mean
754,146,GOod morning,Greet,"Hello, ask me a question!",Hi
755,146,what is omission failure,whQuestion,A failure is a result of the program which is incorrect or not expected. This is caused by an error.,A failure is a result of the program which is incorrect or not expected. This is caused by an error.
756,146,what is fault,whQuestion,"Fault is an incorrect step, process, or data definition in computer program. Fault is the formal name of a bug.","Fault is an incorrect step, process, or data definition in computer program. Fault is the formal name of a bug. A software defect or bug is a condition in a software product which doesn’t meet a software requirement or end-user expectation."
757,146,what is an erro,whQuestion,"Sorry, I still can't answer that.. Could you ask me differently?","Sorry, I didn't understand your question, could you repeat?"
758,146,what is an error,whQuestion,An error is a state of execution of the program which is not expected and may lead to an incorrect result.,An error is a state of execution of the program which is not expected and may lead to an incorrect result.
759,146,what is a failure,whQuestion,A failure is a result of the program which is incorrect or not expected. This is caused by an error.,A failure is a result of the program which is incorrect or not expected. This is caused by an error.
760,146,what failure,whQuestion,"Sorry, I still can't answer that.. Could you ask me differently?",A failure is a result of the program which is incorrect or not expected. This is caused by an error.
761,146,what is external,whQuestion,"Sorry, I still can't answer that.. Could you ask me differently?",A failure is a result of the program which is incorrect or not expected. This is caused by an error.
762,146,what is a defect,whQuestion,A software defect or bug is a condition in a software product which doesn’t meet a software requirement or end-user expectation.,"Fault is an incorrect step, process, or data definition in computer program. Fault is the formal name of a bug. A software defect or bug is a condition in a software product which doesn’t meet a software requirement or end-user expectation."
763,146,what is output,whQuestion,"Sorry, I still can't answer that.. Could you ask me differently?","Sorry, I didn't understand your question, could you repeat?"
764,146,what is a state,whQuestion,"It is a criteria within functional testing, but I still don’t have enough knowledge about that, sorry…",I don't understand what you mean
765,146,no problem,nAnswer,"Sorry, I still can't answer that.. Could you ask me differently?",I don't understand what you mean
766,146,what is test case,whQuestion,"A test case is composed by the test input, the execution conditions and the expected output to be produced by the program.","A test case is composed by the test input, the execution conditions and the expected output to be produced by the program."
