,user,question,question_class,v1_answer,v2:model-20230626-203321
0,100,hi,Greet,"Hello, how are you?",Hi
1,100,Simone,Statement,"Sorry, I still can't answer that.. Could you ask me differently?",Hi
2,100,I am Simone,Statement,"Sorry, I still can't answer that.. Could you ask me differently?",Hi
3,100,what is software testing,whQuestion,"Software testing is an activity of software engineering whose main goal is to validate the project requisites and to assert the software correctness, both before the deployment of the final product as well as during its maintenaice.","Software testing is an activity of software engineering whose main goal is to validate the project requisites and to assert the software correctness, both before the deployment of the final product as well as during its maintenance."
4,100,what is structural testing,whQuestion,"Structural testing (or White-Box testing) is a technique in which tests are derived from the knowledge of the software's structure or internal implementation. That way, the testing professional is able to check if a specific part of the code is correct. Unit testing is an instance of structural testing.","Structural testing (or White-Box testing) is a technique in which tests are derived from the knowledge of the software's structure or internal implementation. That way, the testing professional is able to check if a specific part of the code is correct. Unit testing is an instance of structural testing."
5,100,what is a software technique,whQuestion,"Sorry, I still can't answer that.. Could you ask me differently?","Sorry, I didn't understand your question, could you repeat?"
6,100,what is system testing,whQuestion,System testing is a level of software testing where a complete and integrated software is tested. The purpose of this test is to evaluate the system’s compliance with the specified requirements.,System testing is a level of software testing where a complete and integrated software is tested. The purpose of this test is to evaluate the system’s compliance with the specified requirements.
7,100,what is unit testing,whQuestion,"Unit testing verifies the functioning in isolation of software elements that are separately testable. Depending on the context, these could be the individual subprograms or a larger component made of highly cohesive units. Typically, unit testing occurs with access to the code being tested and with the support of supporting tools. The programmers who wrote the code typically, but not always, conduct unit testing.","Unit testing verifies the functioning in isolation of software elements that are separately testable. Depending on the context, these could be the individual subprograms or a larger component made of highly cohesive units. Typically, unit testing occurs with access to the code being tested and with the support of supporting tools. The programmers who wrote the code typically, but not always, conduct unit testing."
8,100,what is integration testing,whQuestion,"Integration testing is the process of verifying the interactions among software components. Classical integration testing strategies, such as top-down and bottom-up, are often used with hierarchically structured software.","Integration testing is the process of verifying the interactions among software components. Classical integration testing strategies, such as top-down and bottom-up, are often used with hierarchically structured software."
9,100,Can you give me an example of equivalence class partitioning,Clarify,"Here is an example of an application of equivalence partitioning. Consider the following specification: one of the fields of a form is a text box that accepts numeric values from 18 to 25. For this problem, a value that belongs to an invalid equivalence class is 17, whereas a value belonging to a valid equivalence class is, for instance, 20.","Sorry, I didn't quite catch that"
10,100,How do I apply equivalence class partitioning,whQuestion,"The equivalence partitioning criterion divides the input domain in several subsets (partitions) with no intersection and selects a test case for each partition. The idea is that each test case represents all input domain that partition class and, therefore, one test case for each class is enough for this testing criterion. The criterion considers valid and invalid equivalence classes. For example, you can separate invalid and valid inputs into two different subsets or classes.",I don't understand what you mean
11,100,What is verification,whQuestion,"Sorry, I still can't answer that.. Could you ask me differently?","Sorry, I didn't understand your question, could you repeat?"
12,100,what is validation,whQuestion,"Sorry, I still can't answer that.. Could you ask me differently?","Sorry, I didn't understand your question, could you repeat?"
13,100,what is a fault,whQuestion,"Fault is an incorrect step, process, or data definition in computer program. Fault is the formal name of a bug.","Fault is an incorrect step, process, or data definition in computer program. Fault is the formal name of a bug. A software defect or bug is a condition in a software product which doesn’t meet a software requirement or end-user expectation."
14,100,what is a error,whQuestion,An error is a state of execution of the program which is not expected and may lead to an incorrect result.,An error is a state of execution of the program which is not expected and may lead to an incorrect result.
15,100,what is a failure,whQuestion,A failure is a result of the program which is incorrect or not expected. This is caused by an error.,A failure is a result of the program which is incorrect or not expected. This is caused by an error.
16,100,what is white testing,whQuestion,"Software testing is an activity of software engineering whose main goal is to validate the project requisites and to assert the software correctness, both before the deployment of the final product as well as during its maintenaice.","Software testing is an activity of software engineering whose main goal is to validate the project requisites and to assert the software correctness, both before the deployment of the final product as well as during its maintenaice."
17,100,what is white box testing,whQuestion,"Software testing is an activity of software engineering whose main goal is to validate the project requisites and to assert the software correctness, both before the deployment of the final product as well as during its maintenaice.","Software testing is an activity of software engineering whose main goal is to validate the project requisites and to assert the software correctness, both before the deployment of the final product as well as during its maintenaice."
18,100,what is a test case,whQuestion,"A test case is composed by the test input, the execution conditions and the expected output to be produced by the program.","A test case is composed by the test input, the execution conditions and the expected output to be produced by the program."
19,100,what is a oracle,whQuestion,"An oracle is any human or mechanical agent that decides whether a program behaved correctly in a given test and accordingly results in a verdict of “pass” or “fail.” There exist many different kinds of oracles; for example, unambiguous requirements specifications, behavioral models, and code annotations. Automation of mechanized oracles can be difficult and expensive.","An oracle is any human or mechanical agent that decides whether a program behaved correctly in a given test and accordingly results in a verdict of “pass” or “fail.” There exist many different kinds of oracles; for example, unambiguous requirements specifications, behavioral models, and code annotations. Automation of mechanized oracles can be difficult and expensive."
20,100,Hello,Greet,"Hello, how are you?",Hi
21,100,Fine,Statement,"Sorry, I still can't answer that.. Could you ask me differently?",Hi
22,100,what is a test case,whQuestion,"A test case is composed by the test input, the execution conditions and the expected output to be produced by the program.","A test case is composed by the test input, the execution conditions and the expected output to be produced by the program."
23,100,what is a test case,whQuestion,"A test case is composed by the test input, the execution conditions and the expected output to be produced by the program.","A test case is composed by the test input, the execution conditions and the expected output to be produced by the program."
24,100,what is white-box testing,whQuestion,"Software testing is an activity of software engineering whose main goal is to validate the project requisites and to assert the software correctness, both before the deployment of the final product as well as during its maintenaice.","Software testing is an activity of software engineering whose main goal is to validate the project requisites and to assert the software correctness, both before the deployment of the final product as well as during its maintenaice."
25,100,what is white box testing,whQuestion,"Software testing is an activity of software engineering whose main goal is to validate the project requisites and to assert the software correctness, both before the deployment of the final product as well as during its maintenaice.","Software testing is an activity of software engineering whose main goal is to validate the project requisites and to assert the software correctness, both before the deployment of the final product as well as during its maintenaice."
26,100,what is black box testing,whQuestion,"Software testing is an activity of software engineering whose main goal is to validate the project requisites and to assert the software correctness, both before the deployment of the final product as well as during its maintenaice.","Software testing is an activity of software engineering whose main goal is to validate the project requisites and to assert the software correctness, both before the deployment of the final product as well as during its maintenaice."
27,100,Hi,Greet,"Hello, ask me a question!",Hi
28,100,What is black-box testing,whQuestion,"Software testing is an activity of software engineering whose main goal is to validate the project requisites and to assert the software correctness, both before the deployment of the final product as well as during its maintenaice.","Software testing is an activity of software engineering whose main goal is to validate the project requisites and to assert the software correctness, both before the deployment of the final product as well as during its maintenaice."
29,100,what is white box testing,whQuestion,"Software testing is an activity of software engineering whose main goal is to validate the project requisites and to assert the software correctness, both before the deployment of the final product as well as during its maintenaice.","Software testing is an activity of software engineering whose main goal is to validate the project requisites and to assert the software correctness, both before the deployment of the final product as well as during its maintenaice."
30,100,what is structural testing,whQuestion,"Structural testing (or White-Box testing) is a technique in which tests are derived from the knowledge of the software's structure or internal implementation. That way, the testing professional is able to check if a specific part of the code is correct. Unit testing is an instance of structural testing.","Structural testing (or White-Box testing) is a technique in which tests are derived from the knowledge of the software's structure or internal implementation. That way, the testing professional is able to check if a specific part of the code is correct. Unit testing is an instance of structural testing."
31,101,hi,Greet,"Hi there, what do you need?",Hi
32,101,what is software testing,whQuestion,"Software testing is an activity of software engineering whose main goal is to validate the project requisites and to assert the software correctness, both before the deployment of the final product as well as during its maintenaice.","Software testing is an activity of software engineering whose main goal is to validate the project requisites and to assert the software correctness, both before the deployment of the final product as well as during its maintenance."
33,101,what is your name,whQuestion,"I am TOB-STT, a software testing teaching assistant!","Software testing is an activity of software engineering whose main goal is to validate the project requisites and to assert the software correctness, both before the deployment of the final product as well as during its maintenance."
34,101,how can I test my software,Statement,"Sorry, I still can't answer that.. Could you ask me differently?","Sorry, I didn't quite catch that"
35,101,what can you do for me,whQuestion,You can ask me anything related to testing terminology and usage of software testing criterias,I don't understand what you mean
36,101,list for me all testing terminology,Statement,"Sorry, I still can't answer that.. Could you ask me differently?",I don't understand what you mean
37,101,what is a life cycle,whQuestion,"Sorry, I still can't answer that.. Could you ask me differently?",A cycle is a path that connects the first node to the last. They are usually the loops in CFG.
38,101,what do you know,whQuestion,You can ask me anything related to testing terminology and usage of software testing criterias,A cycle is a path that connects the first node to the last. They are usually the loops in CFG.
39,101,what is kanban,whQuestion,"Sorry, I still can't answer that.. Could you ask me differently?",A cycle is a path that connects the first node to the last. They are usually the loops in CFG.
40,101,what is an unit test,whQuestion,"A test, in software testing, is the act of performing some assurance of both the correctness of a software and its validation of the project requisistes.","A test, in software testing, is the act of performing some assurance of both the correctness of a software and its validation of the project requisistes."
41,101,what is a functional testing,whQuestion,"Functional testing (or Black Box Testing) is a technique whereby the system is tested against the functional requirements/specifications. During the functional testing the internal logic of the system being tested is not known to the tester. Functional testing ensures that the requirements are properly satisfied by the system. This type of testing is not concerned with how processing occurs, but rather, with the results of processing. It simulates actual system usage but does not make any system structure assumptions. Functional testing is normally performed during the levels of System Testing and Acceptance Testing.","Functional testing (or Black Box Testing) is a technique whereby the system is tested against the functional requirements/specifications. During the functional testing the internal logic of the system being tested is not known to the tester. Functional testing ensures that the requirements are properly satisfied by the system. This type of testing is not concerned with how processing occurs, but rather, with the results of processing. It simulates actual system usage but does not make any system structure assumptions. Functional testing is normally performed during the levels of System Testing and Acceptance Testing."
42,101,what is acceptance testing,whQuestion,Acceptance testing is a level of software testing where a system is tested for acceptability. The purpose of this test is to evaluate the system’s compliance with the business requirements and assess whether it is acceptable for delivery.,Acceptance testing is a level of software testing where a system is tested for acceptability. The purpose of this test is to evaluate the system’s compliance with the business requirements and assess whether it is acceptable for delivery.
43,101,Regression testing,Statement,"Sorry, I still can't answer that.. Could you ask me differently?","Sorry, I didn't understand your question, could you repeat?"
44,101,Alpha testing,Statement,"Sorry, I still can't answer that.. Could you ask me differently?","Software testing is an activity of software engineering whose main goal is to validate the project requisites and to assert the software correctness, both before the deployment of the final product as well as during its maintenaice."
45,102,Hi,Greet,Welcome!,Hi
46,102,What is software testing,whQuestion,"Software testing is an activity of software engineering whose main goal is to validate the project requisites and to assert the software correctness, both before the deployment of the final product as well as during its maintenaice.","Software testing is an activity of software engineering whose main goal is to validate the project requisites and to assert the software correctness, both before the deployment of the final product as well as during its maintenance."
47,103,hi,Greet,Welcome!,Hi
48,103,Who are you,whQuestion,"I am TOB-STT, a software testing teaching assistant!","Sorry, I didn't quite catch that"
49,103,what can you do,whQuestion,I am here to help you with software testing. I can answer some question you ask me about that topic.,"Sorry, I didn't understand your question, could you repeat?"
50,103,what is test4,whQuestion,"Sorry, I still can't answer that.. Could you ask me differently?","Sorry, I didn't understand your question, could you repeat?"
51,103,what is test,whQuestion,"A test, in software testing, is the act of performing some assurance of both the correctness of a software and its validation of the project requisistes.","A test, in software testing, is the act of performing some assurance of both the correctness of a software and its validation of the project requisistes."
52,103,teste,Statement,"Sorry, I still can't answer that.. Could you ask me differently?","Sorry, I didn't quite catch that"
53,103,test,Statement,"Sorry, I still can't answer that.. Could you ask me differently?","A test, in software testing, is the act of performing some assurance of both the correctness of a software and its validation of the project requisistes."
54,103,o que é teste,nAnswer,"Sorry, I still can't answer that.. Could you ask me differently?","Sorry, I didn't quite catch that"
55,103,bye,Bye,See you!,Bye!
56,103,see you,Statement,Bye bye!,Bye!
57,103,bye bye,Bye,Bye bye!,Bye!
58,103,What is a error,whQuestion,An error is a state of execution of the program which is not expected and may lead to an incorrect result.,An error is a state of execution of the program which is not expected and may lead to an incorrect result.
59,103,what is a fault,whQuestion,"Fault is an incorrect step, process, or data definition in computer program. Fault is the formal name of a bug.","Fault is an incorrect step, process, or data definition in computer program. Fault is the formal name of a bug. A software defect or bug is a condition in a software product which doesn’t meet a software requirement or end-user expectation."
60,103,give a exempla,Statement,"Sorry, I still can't answer that.. Could you ask me differently?","A defect is an incorrect data definition. In your code, it could be an access of inexistent position in a vector, for instance."
61,103,give me a example,Statement,"Sorry, I still can't answer that.. Could you ask me differently?","A defect is an incorrect data definition. In your code, it could be an access of inexistent position in a vector, for instance."
62,103,Can you give me a example of equivalence class partitioning criteria,ynQuestion,"Consider the specification. A program validates a field in the following way: values less than 10 are rejected, values between 10 and 21 are accepted and values greater or equal to 22 are rejected. In this problem, the values 3, 10 and 22 cover all the existing equivalence classes.",I don't understand what you mean
63,103,waht is software testing,Statement,"Sorry, I still can't answer that.. Could you ask me differently?","Software testing is an activity of software engineering whose main goal is to validate the project requisites and to assert the software correctness, both before the deployment of the final product as well as during its maintenance."
64,103,what is software testing,whQuestion,"Software testing is an activity of software engineering whose main goal is to validate the project requisites and to assert the software correctness, both before the deployment of the final product as well as during its maintenaice.","Software testing is an activity of software engineering whose main goal is to validate the project requisites and to assert the software correctness, both before the deployment of the final product as well as during its maintenance."
65,103,fault,Statement,"Sorry, I still can't answer that.. Could you ask me differently?","A defect is an incorrect data definition. In your code, it could be an access of inexistent position in a vector, for instance."
66,103,what is fault,whQuestion,"Fault is an incorrect step, process, or data definition in computer program. Fault is the formal name of a bug.","Fault is an incorrect step, process, or data definition in computer program. Fault is the formal name of a bug. A software defect or bug is a condition in a software product which doesn’t meet a software requirement or end-user expectation."
67,103,what is error,whQuestion,An error is a state of execution of the program which is not expected and may lead to an incorrect result.,An error is a state of execution of the program which is not expected and may lead to an incorrect result.
68,103,what is Failure,whQuestion,A failure is a result of the program which is incorrect or not expected. This is caused by an error.,A failure is a result of the program which is incorrect or not expected. This is caused by an error.
69,103,what is teste case,whQuestion,"Sorry, I still can't answer that.. Could you ask me differently?","Sorry, I didn't understand your question, could you repeat?"
70,103,what is test case,whQuestion,"A test case is composed by the test input, the execution conditions and the expected output to be produced by the program.","A test case is composed by the test input, the execution conditions and the expected output to be produced by the program."
71,103,what is teste coverage,whQuestion,"Sorry, I still can't answer that.. Could you ask me differently?",I don't understand what you mean
72,103,what is testing coverage,whQuestion,"Sorry, I still can't answer that.. Could you ask me differently?",I don't understand what you mean
73,103,what is oracle,whQuestion,"An oracle is any human or mechanical agent that decides whether a program behaved correctly in a given test and accordingly results in a verdict of “pass” or “fail.” There exist many different kinds of oracles; for example, unambiguous requirements specifications, behavioral models, and code annotations. Automation of mechanized oracles can be difficult and expensive.","An oracle is any human or mechanical agent that decides whether a program behaved correctly in a given test and accordingly results in a verdict of “pass” or “fail.” There exist many different kinds of oracles; for example, unambiguous requirements specifications, behavioral models, and code annotations. Automation of mechanized oracles can be difficult and expensive."
74,103,what id oracle problem,whQuestion,"Sorry, I still can't answer that.. Could you ask me differently?","Sorry, I didn't quite catch that"
75,103,what is the aim of testing,whQuestion,"Software testing is an activity of software engineering whose main goal is to validate the project requisites and to assert the software correctness, both before the deployment of the final product as well as during its maintenaice.","Software testing is an activity of software engineering whose main goal is to validate the project requisites and to assert the software correctness, both before the deployment of the final product as well as during its maintenaice."
76,103,what is unit testing,whQuestion,"Unit testing verifies the functioning in isolation of software elements that are separately testable. Depending on the context, these could be the individual subprograms or a larger component made of highly cohesive units. Typically, unit testing occurs with access to the code being tested and with the support of supporting tools. The programmers who wrote the code typically, but not always, conduct unit testing.","Unit testing verifies the functioning in isolation of software elements that are separately testable. Depending on the context, these could be the individual subprograms or a larger component made of highly cohesive units. Typically, unit testing occurs with access to the code being tested and with the support of supporting tools. The programmers who wrote the code typically, but not always, conduct unit testing."
77,103,what is a test case,whQuestion,"A test case is composed by the test input, the execution conditions and the expected output to be produced by the program.","A test case is composed by the test input, the execution conditions and the expected output to be produced by the program."
78,103,what is test selection criteria,whQuestion,"Sorry, I still can't answer that.. Could you ask me differently?","Sorry, I didn't understand your question, could you repeat?"
79,103,what is test criterion,whQuestion,"Sorry, I still can't answer that.. Could you ask me differently?",I don't understand what you mean
