index,user,question,question_class,question_cluster,answer_v1,answer_v2,v1_x_v2
535,12,Could you help me with something?,ynQuestion,174,"Ok, tell me. What is your question?","Sorry, I didn't understand your question, could you repeat?",0.5220559239387512
537,12,Could you tell me what is a test case?,whQuestion,162,"A test case is composed by the input data, the execution conditions and the expected output to be produced by the program.","A test case is composed by the test input, the execution conditions and the expected output to be produced by the program.",0.9632096886634828
539,12,What is a test data?,whQuestion,98,The test data is the input data and the parameters associated with a specified test case.,The test data (or test input) is the input data and the parameters associated with a specified test case.,0.9731829166412354
543,12,what is the difference between a test case and a test data?,whQuestion,236,"A test case is composed by the input data, the execution conditions and the expected output to be produced by the program.. There might be more than one.",The test data (or test input) is the input data and the parameters associated with a specified test case.,0.7150440216064453
544,12,what is the difference between test case and test data?,whQuestion,236,The test data is the input data and the parameters associated with a specific test case.,The test data (or test input) is the input data and the parameters associated with a specified test case.,0.967155396938324
553,130,what is is tests case,whQuestion,152,"Sorry, I still can't answer that.. Could you ask me differently?","Sorry, I didn't understand your question, could you repeat?",0.5751727223396301
554,130,What is test case,whQuestion,152,"A test case is composed by the test input, the execution conditions and the expected output to be produced by the program.","A test case is composed by the test input, the execution conditions and the expected output to be produced by the program.",1.0000001192092896
555,130,Software fault,Statement,249,"Sorry, I still can't answer that.. Could you ask me differently?","Fault is an incorrect step, process, or data definition in computer program. Fault is the formal name of a bug. A software defect or bug is a condition in a software product which doesn’t meet a software requirement or end-user expectation.",0.0517853535711765
556,130,What is software fault,whQuestion,114,"Fault is an incorrect step, process, or data definition in computer program. Fault is the formal name of a bug.","Fault is an incorrect step, process, or data definition in computer program. Fault is the formal name of a bug. A software defect or bug is a condition in a software product which doesn’t meet a software requirement or end-user expectation.",0.9519746899604796
557,130,What is software error,whQuestion,190,An error is a state of execution of the program which is not expected and may lead to an incorrect result.,An error is a state of execution of the program which is not expected and may lead to an incorrect result.,1.0000001192092896
558,130,Software failure,Statement,133,"Sorry, I still can't answer that.. Could you ask me differently?",A failure is a result of the program which is incorrect or not expected. This is caused by an error.,0.1401183605194091
559,130,What is software failure,whQuestion,133,A failure is a result of the program which is incorrect or not expected. This is caused by an error.,A failure is a result of the program which is incorrect or not expected. This is caused by an error.,1.0
560,130,What is software testing,whQuestion,118,"Software testing is an activity of software engineering whose main goal is to validate the project requisites and to assert the software correctness, both before the deployment of the final product as well as during its maintenaice.","Software testing is an activity of software engineering whose main goal is to validate the project requisites and to assert the software correctness, both before the deployment of the final product as well as during its maintenance.",0.9988222718238832
561,130,What is limitation of software testing,whQuestion,149,"Software testing is an activity of software engineering whose main goal is to validate the project requisites and to assert the software correctness, both before the deployment of the final product as well as during its maintenaice.","Software testing is an activity of software engineering whose main goal is to validate the project requisites and to assert the software correctness, both before the deployment of the final product as well as during its maintenance.",0.9988222718238832
562,130,What is test set,whQuestion,156,The test set is composed by several test cases that are used in a software testing activity.,The test set is composed by several test cases that are used in a software testing activity.,1.0000001192092896
563,130,What is testing coverage,whQuestion,79,"Sorry, I still can't answer that.. Could you ask me differently?","Sorry, I didn't quite catch that",0.269802838563919
564,130,What is Oracle problem,whQuestion,164,"Sorry, I still can't answer that.. Could you ask me differently?","An oracle is any human or mechanical agent that decides whether a program behaved correctly in a given test and accordingly results in a verdict of “pass” or “fail.” There exist many different kinds of oracles; for example, unambiguous requirements specifications, behavioral models, and code annotations. Automation of mechanized oracles can be difficult and expensive.",0.0988619700074195
565,130,What is White box testing,Clarify,138,"Software testing is an activity of software engineering whose main goal is to validate the project requisites and to assert the software correctness, both before the deployment of the final product as well as during its maintenaice.","Software testing is an activity of software engineering whose main goal is to validate the project requisites and to assert the software correctness, both before the deployment of the final product as well as during its maintenaice.",1.0
566,130,What is White box,Clarify,132,"Sorry, I still can't answer that.. Could you ask me differently?","Software testing is an activity of software engineering whose main goal is to validate the project requisites and to assert the software correctness, both before the deployment of the final product as well as during its maintenaice.",-0.0242419056594371
567,130,What is white-box,whQuestion,132,"Sorry, I still can't answer that.. Could you ask me differently?","Software testing is an activity of software engineering whose main goal is to validate the project requisites and to assert the software correctness, both before the deployment of the final product as well as during its maintenaice.",-0.0242419056594371
568,130,What is white-box testing,whQuestion,138,"Software testing is an activity of software engineering whose main goal is to validate the project requisites and to assert the software correctness, both before the deployment of the final product as well as during its maintenaice.","Software testing is an activity of software engineering whose main goal is to validate the project requisites and to assert the software correctness, both before the deployment of the final product as well as during its maintenaice.",1.0
569,130,What is integration test,whQuestion,263,"A test, in software testing, is the act of performing some assurance of both the correctness of a software and its validation of the project requisistes.","A test, in software testing, is the act of performing some assurance of both the correctness of a software and its validation of the project requisistes.",1.0
571,131,error,Statement,264,"Sorry, I still can't answer that.. Could you ask me differently?","Sorry, I didn't quite catch that",0.269802838563919
572,131,what is software error,whQuestion,190,An error is a state of execution of the program which is not expected and may lead to an incorrect result.,An error is a state of execution of the program which is not expected and may lead to an incorrect result.,1.0000001192092896
573,132,one of the most important limitations of software testing is that testing can show only the presence of failures,Clarify,100,"Sorry, I still can't answer that.. Could you ask me differently?",I don't understand what you mean,0.3258585929870605
574,132,unit testing,Statement,41,"Sorry, I still can't answer that.. Could you ask me differently?","Unit testing verifies the functioning in isolation of software elements that are separately testable. Depending on the context, these could be the individual subprograms or a larger component made of highly cohesive units. Typically, unit testing occurs with access to the code being tested and with the support of supporting tools. The programmers who wrote the code typically, but not always, conduct unit testing.",-0.0131011130288243
576,132,what is intregation testing,whQuestion,15,"Software testing is an activity of software engineering whose main goal is to validate the project requisites and to assert the software correctness, both before the deployment of the final product as well as during its maintenaice.","Sorry, I didn't understand your question, could you repeat?",0.0063012056052684
577,132,what is well known,whQuestion,16,"Sorry, I still can't answer that.. Could you ask me differently?","Unit testing verifies the functioning in isolation of software elements that are separately testable. Depending on the context, these could be the individual subprograms or a larger component made of highly cohesive units. Typically, unit testing occurs with access to the code being tested and with the support of supporting tools. The programmers who wrote the code typically, but not always, conduct unit testing.",-0.0131011130288243
578,132,what is is bug,whQuestion,59,A software defect or bug is a condition in a software product which doesn’t meet a software requirement or end-user expectation.,"Fault is an incorrect step, process, or data definition in computer program. Fault is the formal name of a bug. A software defect or bug is a condition in a software product which doesn’t meet a software requirement or end-user expectation.",0.8271481990814209
579,132,what is error,whQuestion,112,An error is a state of execution of the program which is not expected and may lead to an incorrect result.,An error is a state of execution of the program which is not expected and may lead to an incorrect result.,1.0000001192092896
580,132,what is fault,whQuestion,145,"Fault is an incorrect step, process, or data definition in computer program. Fault is the formal name of a bug.","Fault is an incorrect step, process, or data definition in computer program. Fault is the formal name of a bug. A software defect or bug is a condition in a software product which doesn’t meet a software requirement or end-user expectation.",0.9519746899604796
581,132,what is failure,whQuestion,75,A failure is a result of the program which is incorrect or not expected. This is caused by an error.,A failure is a result of the program which is incorrect or not expected. This is caused by an error.,1.0
582,133,What is software testing,whQuestion,118,"Software testing is an activity of software engineering whose main goal is to validate the project requisites and to assert the software correctness, both before the deployment of the final product as well as during its maintenaice.","Software testing is an activity of software engineering whose main goal is to validate the project requisites and to assert the software correctness, both before the deployment of the final product as well as during its maintenance.",0.9988222718238832
583,133,What is a successful test,whQuestion,50,"A test, in software testing, is the act of performing some assurance of both the correctness of a software and its validation of the project requisistes.","A test, in software testing, is the act of performing some assurance of both the correctness of a software and its validation of the project requisistes.",1.0
584,133,What is an effective test,whQuestion,50,"A test, in software testing, is the act of performing some assurance of both the correctness of a software and its validation of the project requisistes.","A test, in software testing, is the act of performing some assurance of both the correctness of a software and its validation of the project requisistes.",1.0
585,133,Software fault,Statement,249,"Sorry, I still can't answer that.. Could you ask me differently?","Fault is an incorrect step, process, or data definition in computer program. Fault is the formal name of a bug. A software defect or bug is a condition in a software product which doesn’t meet a software requirement or end-user expectation.",0.0517853535711765
586,133,What is software fault,whQuestion,114,"Fault is an incorrect step, process, or data definition in computer program. Fault is the formal name of a bug.","Fault is an incorrect step, process, or data definition in computer program. Fault is the formal name of a bug. A software defect or bug is a condition in a software product which doesn’t meet a software requirement or end-user expectation.",0.9519746899604796
587,133,What is an error,whQuestion,112,An error is a state of execution of the program which is not expected and may lead to an incorrect result.,An error is a state of execution of the program which is not expected and may lead to an incorrect result.,1.0000001192092896
588,133,What is a failure,whQuestion,75,A failure is a result of the program which is incorrect or not expected. This is caused by an error.,A failure is a result of the program which is incorrect or not expected. This is caused by an error.,1.0
589,133,What is test set,whQuestion,156,The test set is composed by several test cases that are used in a software testing activity.,The test set is composed by several test cases that are used in a software testing activity.,1.0000001192092896
590,133,What is test case,whQuestion,152,"A test case is composed by the test input, the execution conditions and the expected output to be produced by the program.","A test case is composed by the test input, the execution conditions and the expected output to be produced by the program.",1.0000001192092896
591,133,What is coverage criteria,whQuestion,265,"Sorry, I still can't answer that.. Could you ask me differently?","Sorry, I didn't understand your question, could you repeat?",0.5751727223396301
592,133,What is coverage criterion,whQuestion,265,"Sorry, I still can't answer that.. Could you ask me differently?",I don't understand what you mean,0.3258585929870605
593,133,What is oracle problem,whQuestion,164,"Sorry, I still can't answer that.. Could you ask me differently?","Sorry, I didn't quite catch that",0.269802838563919
594,133,What is an oracle problem,whQuestion,164,"Sorry, I still can't answer that.. Could you ask me differently?",I don't understand what you mean,0.3258585929870605
595,133,What is white box test,whQuestion,138,"A test, in software testing, is the act of performing some assurance of both the correctness of a software and its validation of the project requisistes.","A test, in software testing, is the act of performing some assurance of both the correctness of a software and its validation of the project requisistes.",1.0
596,133,What is white-box testing,whQuestion,138,"Software testing is an activity of software engineering whose main goal is to validate the project requisites and to assert the software correctness, both before the deployment of the final product as well as during its maintenaice.","Software testing is an activity of software engineering whose main goal is to validate the project requisites and to assert the software correctness, both before the deployment of the final product as well as during its maintenaice.",1.0
597,133,What is partitioning equuvalence,whQuestion,214,"Sorry, I still can't answer that.. Could you ask me differently?","Sorry, I didn't understand your question, could you repeat?",0.5751727223396301
598,134,What is your purpose,whQuestion,261,"Sorry, I still can't answer that.. Could you ask me differently?","Sorry, I didn't quite catch that",0.269802838563919
600,134,what is black-box testing,whQuestion,163,"Software testing is an activity of software engineering whose main goal is to validate the project requisites and to assert the software correctness, both before the deployment of the final product as well as during its maintenaice.","Software testing is an activity of software engineering whose main goal is to validate the project requisites and to assert the software correctness, both before the deployment of the final product as well as during its maintenaice.",1.0
601,134,what is white-box testing,whQuestion,138,"Software testing is an activity of software engineering whose main goal is to validate the project requisites and to assert the software correctness, both before the deployment of the final product as well as during its maintenaice.","Software testing is an activity of software engineering whose main goal is to validate the project requisites and to assert the software correctness, both before the deployment of the final product as well as during its maintenaice.",1.0
604,134,what testing,whQuestion,177,"Sorry, I still can't answer that.. Could you ask me differently?","Software testing is an activity of software engineering whose main goal is to validate the project requisites and to assert the software correctness, both before the deployment of the final product as well as during its maintenaice.",-0.0242419056594371
605,134,what is testing,whQuestion,177,"Software testing is an activity of software engineering whose main goal is to validate the project requisites and to assert the software correctness, both before the deployment of the final product as well as during its maintenaice.","Software testing is an activity of software engineering whose main goal is to validate the project requisites and to assert the software correctness, both before the deployment of the final product as well as during its maintenaice.",1.0
609,134,what is chicken testing,whQuestion,15,"Software testing is an activity of software engineering whose main goal is to validate the project requisites and to assert the software correctness, both before the deployment of the final product as well as during its maintenaice.","Software testing is an activity of software engineering whose main goal is to validate the project requisites and to assert the software correctness, both before the deployment of the final product as well as during its maintenaice.",1.0
611,134,what is banana testing,whQuestion,15,"Software testing is an activity of software engineering whose main goal is to validate the project requisites and to assert the software correctness, both before the deployment of the final product as well as during its maintenaice.","Software testing is an activity of software engineering whose main goal is to validate the project requisites and to assert the software correctness, both before the deployment of the final product as well as during its maintenaice.",1.0
613,134,what is black box,whQuestion,154,"Sorry, I still can't answer that.. Could you ask me differently?","Software testing is an activity of software engineering whose main goal is to validate the project requisites and to assert the software correctness, both before the deployment of the final product as well as during its maintenaice.",-0.0242419056594371
614,134,what is black-box testing,whQuestion,163,"Software testing is an activity of software engineering whose main goal is to validate the project requisites and to assert the software correctness, both before the deployment of the final product as well as during its maintenaice.","Software testing is an activity of software engineering whose main goal is to validate the project requisites and to assert the software correctness, both before the deployment of the final product as well as during its maintenaice.",1.0
615,134,what is test case,whQuestion,152,"A test case is composed by the test input, the execution conditions and the expected output to be produced by the program.","A test case is composed by the test input, the execution conditions and the expected output to be produced by the program.",1.0000001192092896
617,134,what is unit testing,whQuestion,136,"Unit testing verifies the functioning in isolation of software elements that are separately testable. Depending on the context, these could be the individual subprograms or a larger component made of highly cohesive units. Typically, unit testing occurs with access to the code being tested and with the support of supporting tools. The programmers who wrote the code typically, but not always, conduct unit testing.","Unit testing verifies the functioning in isolation of software elements that are separately testable. Depending on the context, these could be the individual subprograms or a larger component made of highly cohesive units. Typically, unit testing occurs with access to the code being tested and with the support of supporting tools. The programmers who wrote the code typically, but not always, conduct unit testing.",1.000000238418579
618,134,unit testing,Statement,41,"Sorry, I still can't answer that.. Could you ask me differently?","Unit testing verifies the functioning in isolation of software elements that are separately testable. Depending on the context, these could be the individual subprograms or a larger component made of highly cohesive units. Typically, unit testing occurs with access to the code being tested and with the support of supporting tools. The programmers who wrote the code typically, but not always, conduct unit testing.",-0.0131011130288243
619,134,how do you unit test,whQuestion,41,"Sorry, I still can't answer that.. Could you ask me differently?","To create a test set using the McCabe criterion, first write down a complete path always making decisions in predicate nodes to avoid loops (or the first path could be the result of a random real input). Then, the following paths should be equal to the previous one, but changing the decision of the first predicate node not changed yet. After you cannot add any more paths, you have exactly C paths, where C is the McCabe complexity of your CFG. You should create test cases the exercise this paths. This test set also has the property that it satisfies statement coverage and branch coverage criterions.",-0.0117456698790192
620,134,what is functional testing,whQuestion,78,"Functional testing (or Black Box Testing) is a technique whereby the system is tested against the functional requirements/specifications. During the functional testing the internal logic of the system being tested is not known to the tester. Functional testing ensures that the requirements are properly satisfied by the system. This type of testing is not concerned with how processing occurs, but rather, with the results of processing. It simulates actual system usage but does not make any system structure assumptions. Functional testing is normally performed during the levels of System Testing and Acceptance Testing.","Functional testing (or Black Box Testing) is a technique whereby the system is tested against the functional requirements/specifications. During the functional testing the internal logic of the system being tested is not known to the tester. Functional testing ensures that the requirements are properly satisfied by the system. This type of testing is not concerned with how processing occurs, but rather, with the results of processing. It simulates actual system usage but does not make any system structure assumptions. Functional testing is normally performed during the levels of System Testing and Acceptance Testing.",0.9999998807907104
621,134,what is structural testing,whQuestion,23,"Structural testing (or White-Box testing) is a technique in which tests are derived from the knowledge of the software's structure or internal implementation. That way, the testing professional is able to check if a specific part of the code is correct. Unit testing is an instance of structural testing.","Structural testing (or White-Box testing) is a technique in which tests are derived from the knowledge of the software's structure or internal implementation. That way, the testing professional is able to check if a specific part of the code is correct. Unit testing is an instance of structural testing.",1.000000238418579
622,134,what is oracle,whQuestion,181,"An oracle is any human or mechanical agent that decides whether a program behaved correctly in a given test and accordingly results in a verdict of “pass” or “fail.” There exist many different kinds of oracles; for example, unambiguous requirements specifications, behavioral models, and code annotations. Automation of mechanized oracles can be difficult and expensive.","An oracle is any human or mechanical agent that decides whether a program behaved correctly in a given test and accordingly results in a verdict of “pass” or “fail.” There exist many different kinds of oracles; for example, unambiguous requirements specifications, behavioral models, and code annotations. Automation of mechanized oracles can be difficult and expensive.",1.0000001192092896
623,134,what is oracle problem,whQuestion,164,"Sorry, I still can't answer that.. Could you ask me differently?","Sorry, I didn't quite catch that",0.269802838563919
