,Unnamed: 0,user,question,question_class,answer_v1,answer_v2,v1_x_v2
634,634,134,what is software testing,whQuestion,"Software testing is an activity of software engineering whose main goal is to validate the project requisites and to assert the software correctness, both before the deployment of the final product as well as during its maintenaice.","Software testing is an activity of software engineering whose main goal is to validate the project requisites and to assert the software correctness, both before the deployment of the final product as well as during its maintenance.",0.9988222718238831
635,635,134,what is functional testing,whQuestion,"Functional testing (or Black Box Testing) is a technique whereby the system is tested against the functional requirements/specifications. During the functional testing the internal logic of the system being tested is not known to the tester. Functional testing ensures that the requirements are properly satisfied by the system. This type of testing is not concerned with how processing occurs, but rather, with the results of processing. It simulates actual system usage but does not make any system structure assumptions. Functional testing is normally performed during the levels of System Testing and Acceptance Testing.","Functional testing (or Black Box Testing) is a technique whereby the system is tested against the functional requirements/specifications. During the functional testing the internal logic of the system being tested is not known to the tester. Functional testing ensures that the requirements are properly satisfied by the system. This type of testing is not concerned with how processing occurs, but rather, with the results of processing. It simulates actual system usage but does not make any system structure assumptions. Functional testing is normally performed during the levels of System Testing and Acceptance Testing.",0.9999998807907104
636,636,134,what time is it,whQuestion,"Sorry, I still can't answer that.. Could you ask me differently?","Functional testing (or Black Box Testing) is a technique whereby the system is tested against the functional requirements/specifications. During the functional testing the internal logic of the system being tested is not known to the tester. Functional testing ensures that the requirements are properly satisfied by the system. This type of testing is not concerned with how processing occurs, but rather, with the results of processing. It simulates actual system usage but does not make any system structure assumptions. Functional testing is normally performed during the levels of System Testing and Acceptance Testing.",0.06225309520959854
637,637,134,who are you,whQuestion,"I am TOB-STT, a software testing teaching assistant!","Functional testing (or Black Box Testing) is a technique whereby the system is tested against the functional requirements/specifications. During the functional testing the internal logic of the system being tested is not known to the tester. Functional testing ensures that the requirements are properly satisfied by the system. This type of testing is not concerned with how processing occurs, but rather, with the results of processing. It simulates actual system usage but does not make any system structure assumptions. Functional testing is normally performed during the levels of System Testing and Acceptance Testing.",0.18193364143371582
638,638,134,what is your quest,whQuestion,"Sorry, I still can't answer that.. Could you ask me differently?",I don't understand what you mean,0.32585859298706055
639,639,134,what is your favorite color,whQuestion,"Sorry, I still can't answer that.. Could you ask me differently?","Sorry, I didn't understand your question, could you repeat?",0.5751727223396301
640,640,134,what is the top speed of an unladen swallow,Clarify,"Sorry, I still can't answer that.. Could you ask me differently?","Sorry, I didn't quite catch that",0.26980283856391907
641,641,134,Open the pod bay doors,Statement,"Sorry, I still can't answer that.. Could you ask me differently?","Sorry, I didn't quite catch that",0.26980283856391907
642,642,135,why do we use test adequacy criteria,whQuestion,"Sorry, I still can't answer that.. Could you ask me differently?","Sorry, I didn't quite catch that",0.26980283856391907
643,643,135,test adequacy criteria,Statement,"Sorry, I still can't answer that.. Could you ask me differently?","Sorry, I didn't understand your question, could you repeat?",0.5751727223396301
644,644,135,software test phases,Statement,"Sorry, I still can't answer that.. Could you ask me differently?",I don't understand what you mean,0.32585859298706055
645,645,135,help,Statement,"Sorry, I still can't answer that.. Could you ask me differently?",Hi,0.11770277470350266
646,646,135,what are unit testing,whQuestion,"Unit testing verifies the functioning in isolation of software elements that are separately testable. Depending on the context, these could be the individual subprograms or a larger component made of highly cohesive units. Typically, unit testing occurs with access to the code being tested and with the support of supporting tools. The programmers who wrote the code typically, but not always, conduct unit testing.","Unit testing verifies the functioning in isolation of software elements that are separately testable. Depending on the context, these could be the individual subprograms or a larger component made of highly cohesive units. Typically, unit testing occurs with access to the code being tested and with the support of supporting tools. The programmers who wrote the code typically, but not always, conduct unit testing.",1.000000238418579
647,647,135,what are integration testing,whQuestion,"Integration testing is the process of verifying the interactions among software components. Classical integration testing strategies, such as top-down and bottom-up, are often used with hierarchically structured software.","Integration testing is the process of verifying the interactions among software components. Classical integration testing strategies, such as top-down and bottom-up, are often used with hierarchically structured software.",0.9999998807907104
648,648,136,Fault,Statement,"Sorry, I still can't answer that.. Could you ask me differently?","Fault is an incorrect step, process, or data definition in computer program. Fault is the formal name of a bug. A software defect or bug is a condition in a software product which doesn’t meet a software requirement or end-user expectation.",0.05178535357117653
649,649,136,what is a fault,whQuestion,"Fault is an incorrect step, process, or data definition in computer program. Fault is the formal name of a bug.","Fault is an incorrect step, process, or data definition in computer program. Fault is the formal name of a bug. A software defect or bug is a condition in a software product which doesn’t meet a software requirement or end-user expectation.",0.9519746899604797
650,650,136,what is a error,whQuestion,An error is a state of execution of the program which is not expected and may lead to an incorrect result.,An error is a state of execution of the program which is not expected and may lead to an incorrect result.,1.0000001192092896
651,651,136,what is a failure,whQuestion,A failure is a result of the program which is incorrect or not expected. This is caused by an error.,A failure is a result of the program which is incorrect or not expected. This is caused by an error.,1.0
652,652,137,hi,Greet,Welcome!,Hi,0.13563869893550873
653,653,137,how are you,whQuestion,"I am fine, what about you",I don't understand what you mean,0.0380149707198143
654,654,137,fine thanks,Statement,You are welcome! :),No worries!,0.41018155217170715
655,655,137,what is your name,whQuestion,"I am TOB-STT, a software testing teaching assistant!","Sorry, I didn't understand your question, could you repeat?",0.09302129596471786
656,656,138,hi,Greet,"Hi there, what do you need?",Hi,0.5008180737495422
657,657,138,what is software testing,whQuestion,"Software testing is an activity of software engineering whose main goal is to validate the project requisites and to assert the software correctness, both before the deployment of the final product as well as during its maintenaice.","Software testing is an activity of software engineering whose main goal is to validate the project requisites and to assert the software correctness, both before the deployment of the final product as well as during its maintenance.",0.9988222718238831
658,658,139,I need to know what is software testing,Statement,"Software testing is an activity of software engineering whose main goal is to validate the project requisites and to assert the software correctness, both before the deployment of the final product as well as during its maintenaice.","Software testing is an activity of software engineering whose main goal is to validate the project requisites and to assert the software correctness, both before the deployment of the final product as well as during its maintenance.",0.9988222718238831
659,659,139,what is test case,whQuestion,"A test case is composed by the test input, the execution conditions and the expected output to be produced by the program.","A test case is composed by the test input, the execution conditions and the expected output to be produced by the program.",1.0000001192092896
660,660,139,what is white box testing,whQuestion,"Software testing is an activity of software engineering whose main goal is to validate the project requisites and to assert the software correctness, both before the deployment of the final product as well as during its maintenaice.","Software testing is an activity of software engineering whose main goal is to validate the project requisites and to assert the software correctness, both before the deployment of the final product as well as during its maintenaice.",1.0
661,661,139,WHAT IS FUNCTIONAL TESTING,Statement,"Functional testing (or Black Box Testing) is a technique whereby the system is tested against the functional requirements/specifications. During the functional testing the internal logic of the system being tested is not known to the tester. Functional testing ensures that the requirements are properly satisfied by the system. This type of testing is not concerned with how processing occurs, but rather, with the results of processing. It simulates actual system usage but does not make any system structure assumptions. Functional testing is normally performed during the levels of System Testing and Acceptance Testing.","Functional testing (or Black Box Testing) is a technique whereby the system is tested against the functional requirements/specifications. During the functional testing the internal logic of the system being tested is not known to the tester. Functional testing ensures that the requirements are properly satisfied by the system. This type of testing is not concerned with how processing occurs, but rather, with the results of processing. It simulates actual system usage but does not make any system structure assumptions. Functional testing is normally performed during the levels of System Testing and Acceptance Testing.",0.9999998807907104
662,662,13,TOB_STT iniciar conversa,Statement,Hi there! What's your name?,"Sorry, I didn't understand your question, could you repeat?",0.043609727174043655
663,663,140,what is white-box testing,whQuestion,"Software testing is an activity of software engineering whose main goal is to validate the project requisites and to assert the software correctness, both before the deployment of the final product as well as during its maintenaice.","Software testing is an activity of software engineering whose main goal is to validate the project requisites and to assert the software correctness, both before the deployment of the final product as well as during its maintenaice.",1.0
664,664,140,what is fdjsakfhdsjaf testing,whQuestion,"Software testing is an activity of software engineering whose main goal is to validate the project requisites and to assert the software correctness, both before the deployment of the final product as well as during its maintenaice.","Software testing is an activity of software engineering whose main goal is to validate the project requisites and to assert the software correctness, both before the deployment of the final product as well as during its maintenaice.",1.0
665,665,141,jfdklsajfdlsajfsdl,Statement,"Sorry, I still can't answer that.. Could you ask me differently?",Bye!,0.12254242599010468
666,666,142,hello to,Greet,Welcome!,Hi,0.13563869893550873
667,667,142,how are you,whQuestion,Great! How are you?,I don't understand what you mean,-0.010543142445385456
668,668,142,fine,Statement,"Sorry, I still can't answer that.. Could you ask me differently?",Hi,0.11770277470350266
669,669,142,what is software testing,whQuestion,"Software testing is an activity of software engineering whose main goal is to validate the project requisites and to assert the software correctness, both before the deployment of the final product as well as during its maintenaice.","Software testing is an activity of software engineering whose main goal is to validate the project requisites and to assert the software correctness, both before the deployment of the final product as well as during its maintenance.",0.9988222718238831
670,670,142,define model testing,Statement,"Software testing is an activity of software engineering whose main goal is to validate the project requisites and to assert the software correctness, both before the deployment of the final product as well as during its maintenaice.","Software testing is an activity of software engineering whose main goal is to validate the project requisites and to assert the software correctness, both before the deployment of the final product as well as during its maintenaice.",1.0
671,671,142,model based testing,Statement,"Sorry, I still can't answer that.. Could you ask me differently?","Sorry, I didn't quite catch that",0.26980283856391907
672,672,142,can you define black box testing,Clarify,"Sorry, I still can't answer that.. Could you ask me differently?","Software testing is an activity of software engineering whose main goal is to validate the project requisites and to assert the software correctness, both before the deployment of the final product as well as during its maintenaice.",-0.02424190565943718
673,673,142,can you define fault,ynQuestion,"Sorry, I still can't answer that.. Could you ask me differently?","Fault is an incorrect step, process, or data definition in computer program. Fault is the formal name of a bug. A software defect or bug is a condition in a software product which doesn’t meet a software requirement or end-user expectation.",0.05178535357117653
674,674,142,what is falua,whQuestion,"Sorry, I still can't answer that.. Could you ask me differently?",I don't understand what you mean,0.32585859298706055
675,675,142,what is fault,whQuestion,"Fault is an incorrect step, process, or data definition in computer program. Fault is the formal name of a bug.","Fault is an incorrect step, process, or data definition in computer program. Fault is the formal name of a bug. A software defect or bug is a condition in a software product which doesn’t meet a software requirement or end-user expectation.",0.9519746899604797
676,676,142,what is mutation testing,whQuestion,"Software testing is an activity of software engineering whose main goal is to validate the project requisites and to assert the software correctness, both before the deployment of the final product as well as during its maintenaice.",I don't understand what you mean,-0.0011238016886636615
677,677,142,what is mutation,whQuestion,"Sorry, I still can't answer that.. Could you ask me differently?",I don't understand what you mean,0.32585859298706055
678,678,142,what is black box,whQuestion,"Sorry, I still can't answer that.. Could you ask me differently?","Fault is an incorrect step, process, or data definition in computer program. Fault is the formal name of a bug. A software defect or bug is a condition in a software product which doesn’t meet a software requirement or end-user expectation.",0.05178535357117653
679,679,142,can you give me an example of omission fault,Statement,"Suppose you have a program that, by the software requirements, should accept names with up to 20 digits, but the software developer reserved only 15 digits in the database. That is a defect in the software definition and can lead to an error.","A defect is an incorrect data definition. In your code, it could be an access of inexistent position in a vector, for instance.",0.4193035364151001
680,680,142,can you give me an example of incorrect fact,Statement,"Sorry, I still can't answer that.. Could you ask me differently?","Sorry, I didn't understand your question, could you repeat?",0.5751727223396301
681,681,142,can you give me an example of stranger Information,Emphasis,"Sorry, I still can't answer that.. Could you ask me differently?","Sorry, I didn't quite catch that",0.26980283856391907
682,682,142,what is a test case,whQuestion,"A test case is composed by the test input, the execution conditions and the expected output to be produced by the program.","A test case is composed by the test input, the execution conditions and the expected output to be produced by the program.",1.0000001192092896
683,683,142,what is test data,whQuestion,The test data (or test input) is the input data and the parameters associated with a specified test case.,The test data (or test input) is the input data and the parameters associated with a specified test case.,0.9999999403953552
684,684,142,what is test Domain,whQuestion,"Sorry, I still can't answer that.. Could you ask me differently?","Sorry, I didn't understand your question, could you repeat?",0.5751727223396301
685,685,142,what is input domain,whQuestion,The input domain is a set of values that can be used to execute a certain program. The input domain specifies all the possible sets of values.,The input domain is a set of values that can be used to execute a certain program. The input domain specifies all the possible sets of values.,1.0
686,686,142,what is inconsistent information,whQuestion,"Sorry, I still can't answer that.. Could you ask me differently?","Sorry, I didn't understand your question, could you repeat?",0.5751727223396301
687,687,142,can you give me an example of inconsistent information,Statement,"Sorry, I still can't answer that.. Could you ask me differently?","Sorry, I didn't understand your question, could you repeat?",0.5751727223396301
688,688,143,hi,Greet,Welcome!,Hi,0.13563869893550873
689,689,143,tanks,Statement,"Sorry, I still can't answer that.. Could you ask me differently?",No worries!,0.29776671528816223
690,690,143,hi,Greet,"Hi there, what do you need?",Hi,0.5008180737495422
691,691,143,give me an example of omission,Statement,"Sorry, I still can't answer that.. Could you ask me differently?","Sorry, I didn't understand your question, could you repeat?",0.5751727223396301
692,692,143,examplo of emission,Statement,"Sorry, I still can't answer that.. Could you ask me differently?","Sorry, I didn't understand your question, could you repeat?",0.5751727223396301
693,693,143,Can you give me a example of omission,ynQuestion,"Sorry, I still can't answer that.. Could you ask me differently?","Sorry, I didn't quite catch that",0.26980283856391907
694,694,143,Can you give me a example of equivalence class partitioning criteria,ynQuestion,"Here is an example of an application of equivalence partitioning. Consider the following specification: one of the fields of a form is a text box that accepts numeric values from 18 to 25. For this problem, a value that belongs to an invalid equivalence class is 17, whereas a value belonging to a valid equivalence class is, for instance, 20.","Sorry, I didn't quite catch that",0.07069748640060425
695,695,143,Wkato is stranger information,yAnswer,"Sorry, I still can't answer that.. Could you ask me differently?",I don't understand what you mean,0.32585859298706055
696,696,143,what is strange information,whQuestion,"Sorry, I still can't answer that.. Could you ask me differently?","Sorry, I didn't quite catch that",0.26980283856391907
697,697,143,what is structural testing,whQuestion,"Structural testing (or White-Box testing) is a technique in which tests are derived from the knowledge of the software's structure or internal implementation. That way, the testing professional is able to check if a specific part of the code is correct. Unit testing is an instance of structural testing.","Structural testing (or White-Box testing) is a technique in which tests are derived from the knowledge of the software's structure or internal implementation. That way, the testing professional is able to check if a specific part of the code is correct. Unit testing is an instance of structural testing.",1.000000238418579
698,698,143,what is functional testing,whQuestion,"Functional testing (or Black Box Testing) is a technique whereby the system is tested against the functional requirements/specifications. During the functional testing the internal logic of the system being tested is not known to the tester. Functional testing ensures that the requirements are properly satisfied by the system. This type of testing is not concerned with how processing occurs, but rather, with the results of processing. It simulates actual system usage but does not make any system structure assumptions. Functional testing is normally performed during the levels of System Testing and Acceptance Testing.","Functional testing (or Black Box Testing) is a technique whereby the system is tested against the functional requirements/specifications. During the functional testing the internal logic of the system being tested is not known to the tester. Functional testing ensures that the requirements are properly satisfied by the system. This type of testing is not concerned with how processing occurs, but rather, with the results of processing. It simulates actual system usage but does not make any system structure assumptions. Functional testing is normally performed during the levels of System Testing and Acceptance Testing.",0.9999998807907104
699,699,143,what is unit testing,whQuestion,"Unit testing verifies the functioning in isolation of software elements that are separately testable. Depending on the context, these could be the individual subprograms or a larger component made of highly cohesive units. Typically, unit testing occurs with access to the code being tested and with the support of supporting tools. The programmers who wrote the code typically, but not always, conduct unit testing.","Unit testing verifies the functioning in isolation of software elements that are separately testable. Depending on the context, these could be the individual subprograms or a larger component made of highly cohesive units. Typically, unit testing occurs with access to the code being tested and with the support of supporting tools. The programmers who wrote the code typically, but not always, conduct unit testing.",1.000000238418579
700,700,143,what is integration testing,whQuestion,"Integration testing is the process of verifying the interactions among software components. Classical integration testing strategies, such as top-down and bottom-up, are often used with hierarchically structured software.","Integration testing is the process of verifying the interactions among software components. Classical integration testing strategies, such as top-down and bottom-up, are often used with hierarchically structured software.",0.9999998807907104
701,701,143,what is test selection criterion,whQuestion,"Sorry, I still can't answer that.. Could you ask me differently?","Sorry, I didn't understand your question, could you repeat?",0.5751727223396301
702,702,143,what is selection test,whQuestion,"A test, in software testing, is the act of performing some assurance of both the correctness of a software and its validation of the project requisistes.","A test, in software testing, is the act of performing some assurance of both the correctness of a software and its validation of the project requisistes.",1.0
703,703,144,hi,Greet,Welcome!,Hi,0.13563869893550873
704,704,144,pk,Statement,"Sorry, I still can't answer that.. Could you ask me differently?",No worries!,0.29776671528816223
705,705,144,ok,Statement,OK!,"Sorry, I didn't quite catch that",0.22035467624664307
706,706,144,ok,Statement,OK!,"Sorry, I didn't quite catch that",0.22035467624664307
707,707,144,What is a Software Fault,whQuestion,"Fault is an incorrect step, process, or data definition in computer program. Fault is the formal name of a bug.","Fault is an incorrect step, process, or data definition in computer program. Fault is the formal name of a bug. A software defect or bug is a condition in a software product which doesn’t meet a software requirement or end-user expectation.",0.9519746899604797
708,708,144,What is a Software Error,whQuestion,An error is a state of execution of the program which is not expected and may lead to an incorrect result.,An error is a state of execution of the program which is not expected and may lead to an incorrect result.,1.0000001192092896
709,709,144,What is a Software Failure,whQuestion,A failure is a result of the program which is incorrect or not expected. This is caused by an error.,A failure is a result of the program which is incorrect or not expected. This is caused by an error.,1.0
710,710,144,what are design mistakes,whQuestion,"Sorry, I still can't answer that.. Could you ask me differently?",I don't understand what you mean,0.32585859298706055
