,Unnamed: 0,user,question,question_class,answer_v1,answer_v2,v1_x_v2
2237,2237,52,What is a Boundary value analysis?,whQuestion,"Boundary_value_analysis is a functional testing criterion which test data are chosen on or near the boundaries of the input domain of variables, with the underlying rationale that many faults tend to concentrate near the extreme values of inputs. An extension of this technique is robustness testing, wherein test cases are also chosen outside the input domain of variables to test program robustness in processing unexpected or erroneous inputs.","Boundary value analysis is a functional testing criterion which test data are chosen on or near the boundaries of the input domain of variables, with the underlying rationale that many faults tend to concentrate near the extreme values of inputs. An extension of this technique is robustness testing, wherein test cases are also chosen outside the input domain of variables to test program robustness in processing unexpected or erroneous inputs.",0.9890575408935547
2238,2238,52,How to use Boundary value analysis?,whQuestion,"The boundary-value testing criterion determines the boundaries for input values and selects the extremes of the boundary to generate test cases. For instance, if a program's valid input is a positive number less than 10, then the following test cases will be selected in order to test the boundaries: 0, 1, -1, 10, 9 and 11.","The boundary-value testing criterion determines the boundaries for input values and selects the extremes of the boundary to generate test cases. For instance, if a program's valid input is a positive number less than 10, then the following test cases will be selected in order to test the boundaries: 0, 1, -1, 10, 9 and 11.",1.0
2239,2239,52,Another example of Boundary value analysis?,ynQuestion,"Suppose you have a program in which the user has to create a password with length between 6 and 12. So the test cases generated for this program, using the boundary value analysis technique, would be for passwords with lengths 5, 6, 12 and 13.","Suppose you have a program in which the user has to create a password with length between 6 and 12. So the test cases generated for this program, using the boundary value analysis technique, would be for passwords with lengths 5, 6, 12 and 13.",1.0000001192092896
2240,2240,52,another example of Boundary value analysis?,whQuestion,Suppose you have a program that grants access to a certain web page only if you are 18 years old or older. So a boundary value analysis criteria used for this program would generate test cases for age inputs of 17 and 18,Suppose you have a program that grants access to a certain web page only if you are 18 years old or older. So a boundary value analysis criteria used for this program would generate test cases for age inputs of 17 and 18.,0.9978525042533875
2241,2241,52,another example of Boundary value analysis,Statement,"Suppose you have a program in which the user has to create a password with length between 6 and 12. So the test cases generated for this program, using the boundary value analysis technique, would be for passwords with lengths 5, 6, 12 and 13.",Suppose you have a program that grants access to a certain web page only if you are 18 years old or older. So a boundary value analysis criteria used for this program would generate test cases for age inputs of 17 and 18.,0.7441936731338501
2242,2242,52,another example of Boundary value analysis?,whQuestion,Suppose you have a program that grants access to a certain web page only if you are 18 years old or older. So a boundary value analysis criteria used for this program would generate test cases for age inputs of 17 and 18,"Suppose you have a program in which the user has to create a password with length between 6 and 12. So the test cases generated for this program, using the boundary value analysis technique, would be for passwords with lengths 5, 6, 12 and 13.",0.7423320412635803
2243,2243,52,give me an example of partitioning,Statement,I don't know how to respond this,I don't understand what you mean,0.3189530074596405
2244,2244,52,give me an example of equivalence class partitioning,Clarify,I don't know how to respond this,I don't understand what you mean,0.3189530074596405
2245,2245,52,How to use equivalence class partitioning,Clarify,"The equivalence partitioning criterion divides the input domain in several subsets (partitions) with no intersection and selects a test case for each partition. The idea is that each test case represents all input domain that partition class and, therefore, one test case for each class is enough for this testing criterion. The criterion considers valid and invalid equivalence classes. For example, you can separate invalid and valid inputs into two different subsets or classes.","Sorry, I didn't quite catch that",0.057073697447776794
2246,2246,52,another example of equivalence class partitioning?,whQuestion,"Here is an example of an application of equivalence class partitioning. Consider the following specification: one of the fields of a form is a text box that accepts numeric values from 18 to 25. For this problem, a value that belongs to an invalid equivalence class is 17, whereas a value belonging to a valid equivalence class is, for instance, 20.","Sorry, I didn't quite catch that",0.06152264401316643
2247,2247,52,another example of equivalence class partitioning,Clarify,"Here is an example of an application of equivalence class partitioning. Consider the following specification: one of the fields of a form is a text box that accepts numeric values from 18 to 25. For this problem, a value that belongs to an invalid equivalence class is 17, whereas a value belonging to a valid equivalence class is, for instance, 20.",I don't understand what you mean,0.048501309007406235
2248,2248,52,What is a mistake,whQuestion,"A mistake is a human action that inserts a fault (or defect) into the source code, for instance, a typo is a mistake.","A mistake is a human action that inserts a fault (or defect) into the source code, for instance, a typo is a mistake.",1.0000001192092896
2249,2249,52,What is a fault,whQuestion,"Fault is an incorrect step, process, or data definition in computer program. Fault is the formal name of a bug.","Fault is an incorrect step, process, or data definition in computer program. Fault is the formal name of a bug. A software defect or bug is a condition in a software product which doesn’t meet a software requirement or end-user expectation.",0.9519746899604797
2250,2250,52,What is a failure,whQuestion,A failure is a result of the program which is incorrect or not expected. This is caused by an error.,A failure is a result of the program which is incorrect or not expected. This is caused by an error.,1.0
2251,2251,52,What is an error,whQuestion,An error is a state of execution of the program which is not expected and may lead to an incorrect result.,An error is a state of execution of the program which is not expected and may lead to an incorrect result.,1.0000001192092896
2252,2252,52,What is the difference among them?,whQuestion,You tell me.,"Sorry, I didn't understand your question, could you repeat?",0.07924751937389374
2253,2253,52,What is the difference between fault and failure,Clarify,"A fault (or defect) is an incorrect step, process, or data definition in computer program. A fault can lead the program or software to a failure, i.e an incorrect result. Therefore, a failure is an incorrect or not expected result of the program execution.",A failure is a result of the program which is incorrect or not expected. This is caused by an error.,0.7788219451904297
2254,2254,52,Give an example of a mistake,Statement,I don't know how to respond this,"The mistake is the act of, by some reason, introducing a defect in the software. It could be a typo while coding, which makes a for loop start from 1 instead of 0, and therefore introduce a mistake.",-0.0021512701641768217
2255,2255,52,an example of a mistake,Statement,I don't know how to respond this,"The mistake is the act of, by some reason, introducing a defect in the software. It could be a typo while coding, which makes a for loop start from 1 instead of 0, and therefore introduce a mistake.",-0.0021512701641768217
2256,2256,52,another example of a mistake,nAnswer,I don't know how to respond this,"The mistake is the act of, by some reason, introducing a defect in the software. It could be a typo while coding, which makes a for loop start from 1 instead of 0, and therefore introduce a mistake.",-0.0021512701641768217
2257,2257,52,another example of a fault,nAnswer,I don't know how to respond this,"A defect is an incorrect data definition. In your code, it could be an access of inexistent position in a vector, for instance.",0.08868814259767532
2258,2258,52,another example of a failure,Statement,I don't know how to respond this,"A failure occurs when the output of your program is different than expected. So a failure can occur when your factorial calculator program outputs an overflowed result, which is the result of an overflow error during it’s execution.",0.04059145227074623
2259,2259,52,What is a test case,whQuestion,"A test case is composed by the test input, the execution conditions and the expected output to be produced by the program.","A test case is composed by the test input, the execution conditions and the expected output to be produced by the program.",1.0000001192092896
2260,2260,52,What is a data test,whQuestion,Have you tried a web search?,"A test, in software testing, is the act of performing some assurance of both the correctness of a software and its validation of the project requisistes.",0.012201583944261074
2261,2261,52,No because I have you.,Reject,Perhaps you should try.. I don't know how to respond this. I haven't heard anything like that before.,"To create a test set using the McCabe criterion, first write down a complete path always making decisions in predicate nodes to avoid loops (or the first path could be the result of a random real input). Then, the following paths should be equal to the previous one, but changing the decision of the first predicate node not changed yet. After you cannot add any more paths, you have exactly C paths, where C is the McCabe complexity of your CFG. You should create test cases the exercise this paths. This test set also has the property that it satisfies statement coverage and branch coverage criterions.",-0.053200025111436844
2262,2262,52,what is a class under test?,whQuestion,Would you like to know more?,"A test, in software testing, is the act of performing some assurance of both the correctness of a software and its validation of the project requisistes.",-0.03741682320833206
2263,2263,52,yes,yAnswer,What would you like to know?,I don't understand what you mean,0.10165529698133469
2264,2264,52,what does a class under test mean?,Clarify,I can't give you that information.,"A test, in software testing, is the act of performing some assurance of both the correctness of a software and its validation of the project requisistes.",-0.0367685966193676
2265,2265,53,TOB_STT iniciar conversa,Statement,Hi there! What's your name?,I don't understand what you mean,-0.025836601853370667
2266,2266,54,TOB_STT iniciar conversa,Statement,Hi there! What's your name?,"Sorry, I didn't quite catch that",0.009424732066690922
2267,2267,54,Ana,Statement,Hello Ana ! Can you tell me your Numero USP?,Hi,0.3065032660961151
2268,2268,54,1234,Statement,Thank you! What's up?,Hi,0.37862032651901245
2269,2269,54,What is a defect?,whQuestion,What is it to you?,"Fault is an incorrect step, process, or data definition in computer program. Fault is the formal name of a bug. A software defect or bug is a condition in a software product which doesn’t meet a software requirement or end-user expectation.",0.10485700517892838
2270,2270,54,I do not know,Statement,It was a rhetorical question.,"Sorry, I didn't understand your question, could you repeat?",0.2568179965019226
2271,2271,54,??,ynQuestion,I don't know how to respond this,Hi,0.18081431090831757
2272,2272,54,"Please, tell me about test design",Statement,Hi there!,"Sorry, I didn't understand your question, could you repeat?",0.07675904035568237
2273,2273,55,TOB_STT iniciar conversa,Statement,Hi there! What's your name?,"Sorry, I didn't understand your question, could you repeat?",0.043609727174043655
2274,2274,56,TOB_STT iniciar conversa,Statement,Hi there! What's your name?,"Sorry, I didn't understand your question, could you repeat?",0.043609727174043655
2275,2275,56,hi,Greet,Hi there!,Hi,0.6420996189117432
2276,2276,56,how are you?,whQuestion,Great!,I don't understand what you mean,0.07360175997018814
2277,2277,56,what is software testing?,whQuestion,"Software testing is an activity of software engineering whose main goal is to validate the project requisites and to assert the software correctness, both before the deployment of the final product as well as during its maintenaice.","Software testing is an activity of software engineering whose main goal is to validate the project requisites and to assert the software correctness, both before the deployment of the final product as well as during its maintenance.",0.9988222718238831
2278,2278,56,when Patricia?,whQuestion,I don't know how to respond this,"Sorry, I didn't quite catch that",0.17811858654022217
2279,2279,57,TOB_STT iniciar conversa,Statement,Hi there! What's your name?,I don't understand what you mean,-0.025836601853370667
2280,2280,57,Hello,Greet,Hi there!,Hi,0.6420996189117432
2281,2281,57,How are you?,whQuestion,"Im fine, what about you?","Sorry, I didn't quite catch that",-0.0006474190158769488
2282,2282,57,I Am good,Statement,That's good information.,Bye!,0.11502150446176529
2283,2283,57,I do not know software testing,Statement,I don't know how to respond this,"Software testing is an activity of software engineering whose main goal is to validate the project requisites and to assert the software correctness, both before the deployment of the final product as well as during its maintenance.",-0.0383448489010334
2284,2284,57,What do you want?,whQuestion,I don't know how to respond this,"Software testing is an activity of software engineering whose main goal is to validate the project requisites and to assert the software correctness, both before the deployment of the final product as well as during its maintenance.",-0.0383448489010334
2285,2285,57,Are you ok?,ynQuestion,Hi there!,No worries!,0.10320335626602173
2286,2286,57,Hi,Greet,Hi there!,Hi,0.6420996189117432
2287,2287,57,Hello,Greet,Hi there!,Hi,0.6420996189117432
2288,2288,57,I like you,Statement,Thanks for the information.,No worries!,0.3343904912471771
2289,2289,57,Help me,Statement,"Ok, tell me. What is your question?",Hi,0.29104235768318176
2290,2290,57,I d like to know what are the best software testing criteria,whQuestion,Do you mind if I tell other people.,I don't understand what you mean,0.07955983281135559
2291,2291,57,No,nAnswer,OK then I will add it to my gossip files.,Hi,0.11336325109004974
2292,2292,57,Ok,Statement,How can I help you?,Hi,0.28990381956100464
2293,2293,57,Help me,Statement,"Ok, tell me. What is your question?",Hi,0.29104235768318176
2294,2294,58,TOB_STT iniciar conversa,Statement,Hi there! What's your name?,"Sorry, I didn't understand your question, could you repeat?",0.043609727174043655
2295,2295,59,TOB_STT iniciar conversa,Statement,Hi there! What's your name?,I don't understand what you mean,-0.025836601853370667
2296,2296,59,Lucas,Statement,Hello Lucas ! Can you tell me your Numero USP?,Hi,0.3481244444847107
2297,2297,59,TOB_STT iniciar conversa,Statement,Hi there! What's your name?,"Sorry, I didn't quite catch that",0.009424732066690922
2298,2298,59,Can you give me an example of functional testing,ynQuestion,I don't know how to respond this,"In functional testing technique, the functionality of an application is tested by providing inputs to generate the desired outputs. Consider a bus ticket purchase system with the following requirement: The discount amount is calculated as follows: students can purchase up to 100 tickets per month, with a 50% discount; workers can buy up to 50 tickets a month, with a 30% discount; other users do not have discount on the ticket price. The functional testing concentrates in selection of test input (or data test) to test this functionality, for instance, selecting test input for each class of user of the bus (student, worker and others).",0.011507675051689148
2299,2299,59,TOB_STT iniciar conversa,Statement,Hi there! What's your name?,I don't understand what you mean,-0.025836601853370667
2300,2300,59,Lucas Turci,Statement,Hello Lucas Turci ! Can you tell me your Numero USP?,Hi,0.37437522411346436
2301,2301,59,1234,Statement,Thank you! What's up?,Hi,0.37862032651901245
2302,2302,59,Can you give me an example of functional testing,ynQuestion,I don't know how to respond this,"In functional testing technique, the functionality of an application is tested by providing inputs to generate the desired outputs. Consider a bus ticket purchase system with the following requirement: The discount amount is calculated as follows: students can purchase up to 100 tickets per month, with a 50% discount; workers can buy up to 50 tickets a month, with a 30% discount; other users do not have discount on the ticket price. The functional testing concentrates in selection of test input (or data test) to test this functionality, for instance, selecting test input for each class of user of the bus (student, worker and others).",0.011507675051689148
2303,2303,59,example functional testing criteria,Statement,"In functional testing technique, the functionality of an application is tested by providing inputs to generate the desired outputs. Consider a bus ticket purchase system with the following requirement: The discount amount is calculated as follows: students can purchase up to 100 tickets per month, with a 50% discount; workers can buy up to 50 tickets a month, with a 30% discount; other users do not have discount on the ticket price. The functional testing concentrates in selection of test input (or data test) to test this functionality, for instance, selecting test input for each class of user of the bus (student, worker and others).",I don't understand what you mean,0.05266570672392845
2304,2304,59,A example A functional testing,Statement,"In functional testing technique, the functionality of an application is tested by providing inputs to generate the desired outputs. Consider a bus ticket purchase system with the following requirement: The discount amount is calculated as follows: students can purchase up to 100 tickets per month, with a 50% discount; workers can buy up to 50 tickets a month, with a 30% discount; other users do not have discount on the ticket price. The functional testing concentrates in selection of test input (or data test) to test this functionality, for instance, selecting test input for each class of user of the bus (student, worker and others).","In functional testing technique, the functionality of an application is tested by providing inputs to generate the desired outputs. Consider a bus ticket purchase system with the following requirement: The discount amount is calculated as follows: students can purchase up to 100 tickets per month, with a 50% discount; workers can buy up to 50 tickets a month, with a 30% discount; other users do not have discount on the ticket price. The functional testing concentrates in selection of test input (or data test) to test this functionality, for instance, selecting test input for each class of user of the bus (student, worker and others).",1.0
2305,2305,59,A A example A functional testing,Statement,"In functional testing technique, the functionality of an application is tested by providing inputs to generate the desired outputs. Consider a bus ticket purchase system with the following requirement: The discount amount is calculated as follows: students can purchase up to 100 tickets per month, with a 50% discount; workers can buy up to 50 tickets a month, with a 30% discount; other users do not have discount on the ticket price. The functional testing concentrates in selection of test input (or data test) to test this functionality, for instance, selecting test input for each class of user of the bus (student, worker and others).","In functional testing technique, the functionality of an application is tested by providing inputs to generate the desired outputs. Consider a bus ticket purchase system with the following requirement: The discount amount is calculated as follows: students can purchase up to 100 tickets per month, with a 50% discount; workers can buy up to 50 tickets a month, with a 30% discount; other users do not have discount on the ticket price. The functional testing concentrates in selection of test input (or data test) to test this functionality, for instance, selecting test input for each class of user of the bus (student, worker and others).",1.0
2306,2306,59,Can you give me an example A functional testing,Clarify,I don't know how to respond this,"In functional testing technique, the functionality of an application is tested by providing inputs to generate the desired outputs. Consider a bus ticket purchase system with the following requirement: The discount amount is calculated as follows: students can purchase up to 100 tickets per month, with a 50% discount; workers can buy up to 50 tickets a month, with a 30% discount; other users do not have discount on the ticket price. The functional testing concentrates in selection of test input (or data test) to test this functionality, for instance, selecting test input for each class of user of the bus (student, worker and others).",0.011507675051689148
2307,2307,59,Can you give example A functional testing,Clarify,"In functional testing technique, the functionality of an application is tested by providing inputs to generate the desired outputs. Consider a bus ticket purchase system with the following requirement: The discount amount is calculated as follows: students can purchase up to 100 tickets per month, with a 50% discount; workers can buy up to 50 tickets a month, with a 30% discount; other users do not have discount on the ticket price. The functional testing concentrates in selection of test input (or data test) to test this functionality, for instance, selecting test input for each class of user of the bus (student, worker and others).","In functional testing technique, the functionality of an application is tested by providing inputs to generate the desired outputs. Consider a bus ticket purchase system with the following requirement: The discount amount is calculated as follows: students can purchase up to 100 tickets per month, with a 50% discount; workers can buy up to 50 tickets a month, with a 30% discount; other users do not have discount on the ticket price. The functional testing concentrates in selection of test input (or data test) to test this functionality, for instance, selecting test input for each class of user of the bus (student, worker and others).",1.0
2308,2308,59,An you give me example A functional testing,ynQuestion,"In functional testing technique, the functionality of an application is tested by providing inputs to generate the desired outputs. Consider a bus ticket purchase system with the following requirement: The discount amount is calculated as follows: students can purchase up to 100 tickets per month, with a 50% discount; workers can buy up to 50 tickets a month, with a 30% discount; other users do not have discount on the ticket price. The functional testing concentrates in selection of test input (or data test) to test this functionality, for instance, selecting test input for each class of user of the bus (student, worker and others).","In functional testing technique, the functionality of an application is tested by providing inputs to generate the desired outputs. Consider a bus ticket purchase system with the following requirement: The discount amount is calculated as follows: students can purchase up to 100 tickets per month, with a 50% discount; workers can buy up to 50 tickets a month, with a 30% discount; other users do not have discount on the ticket price. The functional testing concentrates in selection of test input (or data test) to test this functionality, for instance, selecting test input for each class of user of the bus (student, worker and others).",1.0
2309,2309,59,Can you give me an example A functional testing,Clarify,I don't know how to respond this,"In functional testing technique, the functionality of an application is tested by providing inputs to generate the desired outputs. Consider a bus ticket purchase system with the following requirement: The discount amount is calculated as follows: students can purchase up to 100 tickets per month, with a 50% discount; workers can buy up to 50 tickets a month, with a 30% discount; other users do not have discount on the ticket price. The functional testing concentrates in selection of test input (or data test) to test this functionality, for instance, selecting test input for each class of user of the bus (student, worker and others).",0.011507675051689148
