index,user,question,question_class,question_cluster,answer_v1,answer_v2,v1_x_v2
1172,157,A design mistake can lead to what,Clarify,227,"Sorry, I still can't answer that.. Could you ask me differently?","A mistake is a human action that inserts a fault (or defect) into the source code, for instance, a typo is a mistake.",0.002799374051392
1173,157,How do the faults in a software appear,whQuestion,114,"Sorry, I still can't answer that.. Could you ask me differently?","Sorry, I didn't understand your question, could you repeat?",0.5751727223396301
1174,157,what is a test case,whQuestion,152,"A test case is composed by the test input, the execution conditions and the expected output to be produced by the program.","A test case is composed by the test input, the execution conditions and the expected output to be produced by the program.",1.0000001192092896
1175,157,what is test set,whQuestion,156,The test set is composed by several test cases that are used in a software testing activity.,The test set is composed by several test cases that are used in a software testing activity.,1.0000001192092896
1176,157,what is test coverage,whQuestion,79,"Sorry, I still can't answer that.. Could you ask me differently?","Sorry, I didn't understand your question, could you repeat?",0.5751727223396301
1177,157,what is testing coverage,whQuestion,79,"Sorry, I still can't answer that.. Could you ask me differently?",I don't understand what you mean,0.3258585929870605
1178,157,what are the components of a test case,whQuestion,8,"A test case is composed by the test input, the execution conditions and the expected output to be produced by the program.","A test case is composed by the test input, the execution conditions and the expected output to be produced by the program.",1.0000001192092896
1179,157,classification of software testing,Statement,18,"Sorry, I still can't answer that.. Could you ask me differently?","Software testing is an activity of software engineering whose main goal is to validate the project requisites and to assert the software correctness, both before the deployment of the final product as well as during its maintenance.",-0.0304460600018501
1180,157,classification of test techniques,Statement,211,"Sorry, I still can't answer that.. Could you ask me differently?","Sorry, I didn't understand your question, could you repeat?",0.5751727223396301
1181,157,what is structural testing,whQuestion,23,"Structural testing (or White-Box testing) is a technique in which tests are derived from the knowledge of the software's structure or internal implementation. That way, the testing professional is able to check if a specific part of the code is correct. Unit testing is an instance of structural testing.","Structural testing (or White-Box testing) is a technique in which tests are derived from the knowledge of the software's structure or internal implementation. That way, the testing professional is able to check if a specific part of the code is correct. Unit testing is an instance of structural testing.",1.000000238418579
1182,157,what is functional testing,whQuestion,78,"Functional testing (or Black Box Testing) is a technique whereby the system is tested against the functional requirements/specifications. During the functional testing the internal logic of the system being tested is not known to the tester. Functional testing ensures that the requirements are properly satisfied by the system. This type of testing is not concerned with how processing occurs, but rather, with the results of processing. It simulates actual system usage but does not make any system structure assumptions. Functional testing is normally performed during the levels of System Testing and Acceptance Testing.","Functional testing (or Black Box Testing) is a technique whereby the system is tested against the functional requirements/specifications. During the functional testing the internal logic of the system being tested is not known to the tester. Functional testing ensures that the requirements are properly satisfied by the system. This type of testing is not concerned with how processing occurs, but rather, with the results of processing. It simulates actual system usage but does not make any system structure assumptions. Functional testing is normally performed during the levels of System Testing and Acceptance Testing.",0.9999998807907104
1183,157,what is unit testing,whQuestion,136,"Unit testing verifies the functioning in isolation of software elements that are separately testable. Depending on the context, these could be the individual subprograms or a larger component made of highly cohesive units. Typically, unit testing occurs with access to the code being tested and with the support of supporting tools. The programmers who wrote the code typically, but not always, conduct unit testing.","Unit testing verifies the functioning in isolation of software elements that are separately testable. Depending on the context, these could be the individual subprograms or a larger component made of highly cohesive units. Typically, unit testing occurs with access to the code being tested and with the support of supporting tools. The programmers who wrote the code typically, but not always, conduct unit testing.",1.000000238418579
1184,157,what is integration testing,whQuestion,263,"Integration testing is the process of verifying the interactions among software components. Classical integration testing strategies, such as top-down and bottom-up, are often used with hierarchically structured software.","Integration testing is the process of verifying the interactions among software components. Classical integration testing strategies, such as top-down and bottom-up, are often used with hierarchically structured software.",0.9999998807907104
1185,158,what is Software Fault,whQuestion,114,"Fault is an incorrect step, process, or data definition in computer program. Fault is the formal name of a bug.","Fault is an incorrect step, process, or data definition in computer program. Fault is the formal name of a bug. A software defect or bug is a condition in a software product which doesn’t meet a software requirement or end-user expectation.",0.9519746899604796
1186,158,what is software error,whQuestion,190,An error is a state of execution of the program which is not expected and may lead to an incorrect result.,An error is a state of execution of the program which is not expected and may lead to an incorrect result.,1.0000001192092896
1187,158,what is Software Failure,whQuestion,133,A failure is a result of the program which is incorrect or not expected. This is caused by an error.,A failure is a result of the program which is incorrect or not expected. This is caused by an error.,1.0
1188,158,what is a testing coverage,whQuestion,79,"Sorry, I still can't answer that.. Could you ask me differently?","Sorry, I didn't quite catch that",0.269802838563919
1189,158,testing coverage,Statement,79,"Sorry, I still can't answer that.. Could you ask me differently?",I don't understand what you mean,0.3258585929870605
1190,158,property of a test set,Statement,248,"Sorry, I still can't answer that.. Could you ask me differently?",The test set is composed by several test cases that are used in a software testing activity.,0.1574497520923614
1191,159,What is the difference between fault and failure,Clarify,3,"Fault is an incorrect step, process, or data definition in computer program. Fault is the formal name of a bug. A failure is a result of the program which is incorrect or not expected. This is caused by an error.",A failure is a result of the program which is incorrect or not expected. This is caused by an error.,0.7416714429855347
1192,159,What is the difference between structural testing and functional testing,whQuestion,222,"Structural testing (or White-Box testing) is a technique in which tests are derived from the knowledge of the software's structure or internal implementation. That way, the testing professional is able to check if a specific part of the code is correct. Unit testing is an instance of structural testing. Functional testing (or Black Box Testing) is a technique whereby the system is tested against the functional requirements/specifications. During the functional testing the internal logic of the system being tested is not known to the tester. Functional testing ensures that the requirements are properly satisfied by the system. This type of testing is not concerned with how processing occurs, but rather, with the results of processing. It simulates actual system usage but does not make any system structure assumptions. Functional testing is normally performed during the levels of System Testing and Acceptance Testing.","Functional testing (or Black Box Testing) is a technique whereby the system is tested against the functional requirements/specifications. During the functional testing the internal logic of the system being tested is not known to the tester. Functional testing ensures that the requirements are properly satisfied by the system. This type of testing is not concerned with how processing occurs, but rather, with the results of processing. It simulates actual system usage but does not make any system structure assumptions. Functional testing is normally performed during the levels of System Testing and Acceptance Testing.",0.873954176902771
1193,159,What is the difference between test case and test set,Clarify,236,"A test case is composed by the test input, the execution conditions and the expected output to be produced by the program. The test set is composed by several test cases that are used in a software testing activity.",The test set is composed by several test cases that are used in a software testing activity.,0.7703293561935425
1194,159,what is an integration testing,whQuestion,263,"Integration testing is the process of verifying the interactions among software components. Classical integration testing strategies, such as top-down and bottom-up, are often used with hierarchically structured software.","Integration testing is the process of verifying the interactions among software components. Classical integration testing strategies, such as top-down and bottom-up, are often used with hierarchically structured software.",0.9999998807907104
1195,159,what is a fault,whQuestion,145,"Fault is an incorrect step, process, or data definition in computer program. Fault is the formal name of a bug.","Fault is an incorrect step, process, or data definition in computer program. Fault is the formal name of a bug. A software defect or bug is a condition in a software product which doesn’t meet a software requirement or end-user expectation.",0.9519746899604796
1196,159,what is error,whQuestion,112,An error is a state of execution of the program which is not expected and may lead to an incorrect result.,An error is a state of execution of the program which is not expected and may lead to an incorrect result.,1.0000001192092896
1197,159,what is failure,whQuestion,75,A failure is a result of the program which is incorrect or not expected. This is caused by an error.,A failure is a result of the program which is incorrect or not expected. This is caused by an error.,1.0
1198,159,what is design mistakes,whQuestion,227,"Sorry, I still can't answer that.. Could you ask me differently?","Sorry, I didn't understand your question, could you repeat?",0.5751727223396301
1206,15,Can you help me with something?,ynQuestion,174,"Ok, tell me. What is your question?","Sorry, I didn't quite catch that",0.1745912879705429
1207,15,What is software testing?,whQuestion,254,"Software testing is an activity of software engineering whose main goal is to validate the project requisites and to assert the software correctness, both before the deployment of the final product as well as during its maintenaice.","Software testing is an activity of software engineering whose main goal is to validate the project requisites and to assert the software correctness, both before the deployment of the final product as well as during its maintenance.",0.9988222718238832
1210,160,what is a fault,whQuestion,145,"Fault is an incorrect step, process, or data definition in computer program. Fault is the formal name of a bug.","Fault is an incorrect step, process, or data definition in computer program. Fault is the formal name of a bug. A software defect or bug is a condition in a software product which doesn’t meet a software requirement or end-user expectation.",0.9519746899604796
1211,160,what is a error,whQuestion,112,An error is a state of execution of the program which is not expected and may lead to an incorrect result.,An error is a state of execution of the program which is not expected and may lead to an incorrect result.,1.0000001192092896
1212,160,what is a failure,whQuestion,75,A failure is a result of the program which is incorrect or not expected. This is caused by an error.,A failure is a result of the program which is incorrect or not expected. This is caused by an error.,1.0
1213,160,what is a test case,whQuestion,152,"A test case is composed by the test input, the execution conditions and the expected output to be produced by the program.","A test case is composed by the test input, the execution conditions and the expected output to be produced by the program.",1.0000001192092896
1214,160,what is a test,whQuestion,177,"A test, in software testing, is the act of performing some assurance of both the correctness of a software and its validation of the project requisistes.","A test, in software testing, is the act of performing some assurance of both the correctness of a software and its validation of the project requisistes.",1.0
1215,160,what is a test set,whQuestion,156,The test set is composed by several test cases that are used in a software testing activity.,The test set is composed by several test cases that are used in a software testing activity.,1.0000001192092896
1216,160,what is a testing coverage,whQuestion,79,"Sorry, I still can't answer that.. Could you ask me differently?","Sorry, I didn't understand your question, could you repeat?",0.5751727223396301
1218,160,what is a structural testing,whQuestion,23,"Structural testing (or White-Box testing) is a technique in which tests are derived from the knowledge of the software's structure or internal implementation. That way, the testing professional is able to check if a specific part of the code is correct. Unit testing is an instance of structural testing.","Structural testing (or White-Box testing) is a technique in which tests are derived from the knowledge of the software's structure or internal implementation. That way, the testing professional is able to check if a specific part of the code is correct. Unit testing is an instance of structural testing.",1.000000238418579
1219,160,what is a functional testing,whQuestion,78,"Functional testing (or Black Box Testing) is a technique whereby the system is tested against the functional requirements/specifications. During the functional testing the internal logic of the system being tested is not known to the tester. Functional testing ensures that the requirements are properly satisfied by the system. This type of testing is not concerned with how processing occurs, but rather, with the results of processing. It simulates actual system usage but does not make any system structure assumptions. Functional testing is normally performed during the levels of System Testing and Acceptance Testing.","Functional testing (or Black Box Testing) is a technique whereby the system is tested against the functional requirements/specifications. During the functional testing the internal logic of the system being tested is not known to the tester. Functional testing ensures that the requirements are properly satisfied by the system. This type of testing is not concerned with how processing occurs, but rather, with the results of processing. It simulates actual system usage but does not make any system structure assumptions. Functional testing is normally performed during the levels of System Testing and Acceptance Testing.",0.9999998807907104
1220,160,what is a unit testing,whQuestion,136,"Unit testing verifies the functioning in isolation of software elements that are separately testable. Depending on the context, these could be the individual subprograms or a larger component made of highly cohesive units. Typically, unit testing occurs with access to the code being tested and with the support of supporting tools. The programmers who wrote the code typically, but not always, conduct unit testing.","Unit testing verifies the functioning in isolation of software elements that are separately testable. Depending on the context, these could be the individual subprograms or a larger component made of highly cohesive units. Typically, unit testing occurs with access to the code being tested and with the support of supporting tools. The programmers who wrote the code typically, but not always, conduct unit testing.",1.000000238418579
1221,160,what is an unit testing,whQuestion,136,"Unit testing verifies the functioning in isolation of software elements that are separately testable. Depending on the context, these could be the individual subprograms or a larger component made of highly cohesive units. Typically, unit testing occurs with access to the code being tested and with the support of supporting tools. The programmers who wrote the code typically, but not always, conduct unit testing.","Unit testing verifies the functioning in isolation of software elements that are separately testable. Depending on the context, these could be the individual subprograms or a larger component made of highly cohesive units. Typically, unit testing occurs with access to the code being tested and with the support of supporting tools. The programmers who wrote the code typically, but not always, conduct unit testing.",1.000000238418579
1222,160,wat is a unit test,Statement,136,"Unit testing verifies the functioning in isolation of software elements that are separately testable. Depending on the context, these could be the individual subprograms or a larger component made of highly cohesive units. Typically, unit testing occurs with access to the code being tested and with the support of supporting tools. The programmers who wrote the code typically, but not always, conduct unit testing.","A test, in software testing, is the act of performing some assurance of both the correctness of a software and its validation of the project requisistes.",0.6376076340675354
1223,160,what is an integration testing,whQuestion,263,"Integration testing is the process of verifying the interactions among software components. Classical integration testing strategies, such as top-down and bottom-up, are often used with hierarchically structured software.","Integration testing is the process of verifying the interactions among software components. Classical integration testing strategies, such as top-down and bottom-up, are often used with hierarchically structured software.",0.9999998807907104
1224,160,phases of the test,Statement,123,"Sorry, I still can't answer that.. Could you ask me differently?","A test, in software testing, is the act of performing some assurance of both the correctness of a software and its validation of the project requisistes.",0.0337043590843677
1225,160,what are the fases of the test,whQuestion,72,"A test, in software testing, is the act of performing some assurance of both the correctness of a software and its validation of the project requisistes.","A test, in software testing, is the act of performing some assurance of both the correctness of a software and its validation of the project requisistes.",1.0
1226,160,what phases of a test software,Statement,123,"Sorry, I still can't answer that.. Could you ask me differently?",I don't understand what you mean,0.3258585929870605
1227,160,What are the phases of a test software,whQuestion,123,"Sorry, I still can't answer that.. Could you ask me differently?","Sorry, I didn't understand your question, could you repeat?",0.5751727223396301
1228,160,equivalence partitioning,Statement,188,"Sorry, I still can't answer that.. Could you ask me differently?","Equivalence partitioning is a functional testing criterion that involves partitioning the input domain into a collection of subsets (or equivalent classes). Data in each partition must behave the same way therefore only one condition needs to be tested. Similarly, if one condition in a partition doesn’t work, then none of the others will work.",0.0567896477878093
1229,160,what is a equivalence partitioning,whQuestion,173,"Equivalence partitioning is a functional testing criterion that involves partitioning the input domain into a collection of subsets (or equivalent classes). Data in each partition must behave the same way therefore only one condition needs to be tested. Similarly, if one condition in a partition doesn’t work, then none of the others will work.","Equivalence partitioning is a functional testing criterion that involves partitioning the input domain into a collection of subsets (or equivalent classes). Data in each partition must behave the same way therefore only one condition needs to be tested. Similarly, if one condition in a partition doesn’t work, then none of the others will work.",1.0000001192092896
1230,161,what is a software test,whQuestion,118,"A test, in software testing, is the act of performing some assurance of both the correctness of a software and its validation of the project requisistes.","A test, in software testing, is the act of performing some assurance of both the correctness of a software and its validation of the project requisistes.",1.0
1231,161,what is a fault,whQuestion,145,"Fault is an incorrect step, process, or data definition in computer program. Fault is the formal name of a bug.","Fault is an incorrect step, process, or data definition in computer program. Fault is the formal name of a bug. A software defect or bug is a condition in a software product which doesn’t meet a software requirement or end-user expectation.",0.9519746899604796
1232,161,error,Statement,264,"Sorry, I still can't answer that.. Could you ask me differently?","Sorry, I didn't understand your question, could you repeat?",0.5751727223396301
1233,161,what is a error,whQuestion,112,An error is a state of execution of the program which is not expected and may lead to an incorrect result.,An error is a state of execution of the program which is not expected and may lead to an incorrect result.,1.0000001192092896
1234,161,what is a failure,whQuestion,75,A failure is a result of the program which is incorrect or not expected. This is caused by an error.,A failure is a result of the program which is incorrect or not expected. This is caused by an error.,1.0
1235,161,what is a test case,whQuestion,152,"A test case is composed by the test input, the execution conditions and the expected output to be produced by the program.","A test case is composed by the test input, the execution conditions and the expected output to be produced by the program.",1.0000001192092896
1236,161,what is stuctural tesing,whQuestion,11,"Sorry, I still can't answer that.. Could you ask me differently?",I don't understand what you mean,0.3258585929870605
1237,161,what is structural testing,whQuestion,23,"Structural testing (or White-Box testing) is a technique in which tests are derived from the knowledge of the software's structure or internal implementation. That way, the testing professional is able to check if a specific part of the code is correct. Unit testing is an instance of structural testing.","Structural testing (or White-Box testing) is a technique in which tests are derived from the knowledge of the software's structure or internal implementation. That way, the testing professional is able to check if a specific part of the code is correct. Unit testing is an instance of structural testing.",1.000000238418579
1238,161,what is unit testing,whQuestion,136,"Unit testing verifies the functioning in isolation of software elements that are separately testable. Depending on the context, these could be the individual subprograms or a larger component made of highly cohesive units. Typically, unit testing occurs with access to the code being tested and with the support of supporting tools. The programmers who wrote the code typically, but not always, conduct unit testing.","Unit testing verifies the functioning in isolation of software elements that are separately testable. Depending on the context, these could be the individual subprograms or a larger component made of highly cohesive units. Typically, unit testing occurs with access to the code being tested and with the support of supporting tools. The programmers who wrote the code typically, but not always, conduct unit testing.",1.000000238418579
