,Unnamed: 0,user,question,question_class,answer_v1,answer_v2,v1_x_v2
0,0,100,hi,Greet,"Hello, how are you?",Hi,0.6183379888534546
1,1,100,Simone,Statement,"Sorry, I still can't answer that.. Could you ask me differently?",Hi,0.11770277470350266
2,2,100,I am Simone,Statement,"Sorry, I still can't answer that.. Could you ask me differently?","Sorry, I didn't understand your question, could you repeat?",0.5751727223396301
3,3,100,what is software testing,whQuestion,"Software testing is an activity of software engineering whose main goal is to validate the project requisites and to assert the software correctness, both before the deployment of the final product as well as during its maintenaice.","Software testing is an activity of software engineering whose main goal is to validate the project requisites and to assert the software correctness, both before the deployment of the final product as well as during its maintenance.",0.9988222718238831
4,4,100,what is structural testing,whQuestion,"Structural testing (or White-Box testing) is a technique in which tests are derived from the knowledge of the software's structure or internal implementation. That way, the testing professional is able to check if a specific part of the code is correct. Unit testing is an instance of structural testing.","Structural testing (or White-Box testing) is a technique in which tests are derived from the knowledge of the software's structure or internal implementation. That way, the testing professional is able to check if a specific part of the code is correct. Unit testing is an instance of structural testing.",1.000000238418579
5,5,100,what is a software technique,whQuestion,"Sorry, I still can't answer that.. Could you ask me differently?",I don't understand what you mean,0.32585859298706055
6,6,100,what is system testing,whQuestion,System testing is a level of software testing where a complete and integrated software is tested. The purpose of this test is to evaluate the system’s compliance with the specified requirements.,System testing is a level of software testing where a complete and integrated software is tested. The purpose of this test is to evaluate the system’s compliance with the specified requirements.,1.0000001192092896
7,7,100,what is unit testing,whQuestion,"Unit testing verifies the functioning in isolation of software elements that are separately testable. Depending on the context, these could be the individual subprograms or a larger component made of highly cohesive units. Typically, unit testing occurs with access to the code being tested and with the support of supporting tools. The programmers who wrote the code typically, but not always, conduct unit testing.","Unit testing verifies the functioning in isolation of software elements that are separately testable. Depending on the context, these could be the individual subprograms or a larger component made of highly cohesive units. Typically, unit testing occurs with access to the code being tested and with the support of supporting tools. The programmers who wrote the code typically, but not always, conduct unit testing.",1.000000238418579
8,8,100,what is integration testing,whQuestion,"Integration testing is the process of verifying the interactions among software components. Classical integration testing strategies, such as top-down and bottom-up, are often used with hierarchically structured software.","Integration testing is the process of verifying the interactions among software components. Classical integration testing strategies, such as top-down and bottom-up, are often used with hierarchically structured software.",0.9999998807907104
9,9,100,Can you give me an example of equivalence class partitioning,Clarify,"Here is an example of an application of equivalence partitioning. Consider the following specification: one of the fields of a form is a text box that accepts numeric values from 18 to 25. For this problem, a value that belongs to an invalid equivalence class is 17, whereas a value belonging to a valid equivalence class is, for instance, 20.","Sorry, I didn't understand your question, could you repeat?",0.04575951397418976
10,10,100,How do I apply equivalence class partitioning,whQuestion,"The equivalence partitioning criterion divides the input domain in several subsets (partitions) with no intersection and selects a test case for each partition. The idea is that each test case represents all input domain that partition class and, therefore, one test case for each class is enough for this testing criterion. The criterion considers valid and invalid equivalence classes. For example, you can separate invalid and valid inputs into two different subsets or classes.","Sorry, I didn't quite catch that",0.057073697447776794
11,11,100,What is verification,whQuestion,"Sorry, I still can't answer that.. Could you ask me differently?",I don't understand what you mean,0.32585859298706055
12,12,100,what is validation,whQuestion,"Sorry, I still can't answer that.. Could you ask me differently?","Sorry, I didn't quite catch that",0.26980283856391907
13,13,100,what is a fault,whQuestion,"Fault is an incorrect step, process, or data definition in computer program. Fault is the formal name of a bug.","Fault is an incorrect step, process, or data definition in computer program. Fault is the formal name of a bug. A software defect or bug is a condition in a software product which doesn’t meet a software requirement or end-user expectation.",0.9519746899604797
14,14,100,what is a error,whQuestion,An error is a state of execution of the program which is not expected and may lead to an incorrect result.,An error is a state of execution of the program which is not expected and may lead to an incorrect result.,1.0000001192092896
15,15,100,what is a failure,whQuestion,A failure is a result of the program which is incorrect or not expected. This is caused by an error.,A failure is a result of the program which is incorrect or not expected. This is caused by an error.,1.0
16,16,100,what is white testing,whQuestion,"Software testing is an activity of software engineering whose main goal is to validate the project requisites and to assert the software correctness, both before the deployment of the final product as well as during its maintenaice.","Software testing is an activity of software engineering whose main goal is to validate the project requisites and to assert the software correctness, both before the deployment of the final product as well as during its maintenaice.",1.0
17,17,100,what is white box testing,whQuestion,"Software testing is an activity of software engineering whose main goal is to validate the project requisites and to assert the software correctness, both before the deployment of the final product as well as during its maintenaice.","Software testing is an activity of software engineering whose main goal is to validate the project requisites and to assert the software correctness, both before the deployment of the final product as well as during its maintenaice.",1.0
18,18,100,what is a test case,whQuestion,"A test case is composed by the test input, the execution conditions and the expected output to be produced by the program.","A test case is composed by the test input, the execution conditions and the expected output to be produced by the program.",1.0000001192092896
19,19,100,what is a oracle,whQuestion,"An oracle is any human or mechanical agent that decides whether a program behaved correctly in a given test and accordingly results in a verdict of “pass” or “fail.” There exist many different kinds of oracles; for example, unambiguous requirements specifications, behavioral models, and code annotations. Automation of mechanized oracles can be difficult and expensive.","An oracle is any human or mechanical agent that decides whether a program behaved correctly in a given test and accordingly results in a verdict of “pass” or “fail.” There exist many different kinds of oracles; for example, unambiguous requirements specifications, behavioral models, and code annotations. Automation of mechanized oracles can be difficult and expensive.",1.0000001192092896
20,20,100,Hello,Greet,"Hello, how are you?",Hi,0.6183379888534546
21,21,100,Fine,Statement,"Sorry, I still can't answer that.. Could you ask me differently?",Hi,0.11770277470350266
22,22,100,what is a test case,whQuestion,"A test case is composed by the test input, the execution conditions and the expected output to be produced by the program.","A test case is composed by the test input, the execution conditions and the expected output to be produced by the program.",1.0000001192092896
23,23,100,what is a test case,whQuestion,"A test case is composed by the test input, the execution conditions and the expected output to be produced by the program.","A test case is composed by the test input, the execution conditions and the expected output to be produced by the program.",1.0000001192092896
24,24,100,what is white-box testing,whQuestion,"Software testing is an activity of software engineering whose main goal is to validate the project requisites and to assert the software correctness, both before the deployment of the final product as well as during its maintenaice.","Software testing is an activity of software engineering whose main goal is to validate the project requisites and to assert the software correctness, both before the deployment of the final product as well as during its maintenaice.",1.0
25,25,100,what is white box testing,whQuestion,"Software testing is an activity of software engineering whose main goal is to validate the project requisites and to assert the software correctness, both before the deployment of the final product as well as during its maintenaice.","Software testing is an activity of software engineering whose main goal is to validate the project requisites and to assert the software correctness, both before the deployment of the final product as well as during its maintenaice.",1.0
26,26,100,what is black box testing,whQuestion,"Software testing is an activity of software engineering whose main goal is to validate the project requisites and to assert the software correctness, both before the deployment of the final product as well as during its maintenaice.","Software testing is an activity of software engineering whose main goal is to validate the project requisites and to assert the software correctness, both before the deployment of the final product as well as during its maintenaice.",1.0
27,27,100,Hi,Greet,"Hello, ask me a question!",Hi,0.556562602519989
28,28,100,What is black-box testing,whQuestion,"Software testing is an activity of software engineering whose main goal is to validate the project requisites and to assert the software correctness, both before the deployment of the final product as well as during its maintenaice.","Software testing is an activity of software engineering whose main goal is to validate the project requisites and to assert the software correctness, both before the deployment of the final product as well as during its maintenaice.",1.0
29,29,100,what is white box testing,whQuestion,"Software testing is an activity of software engineering whose main goal is to validate the project requisites and to assert the software correctness, both before the deployment of the final product as well as during its maintenaice.","Software testing is an activity of software engineering whose main goal is to validate the project requisites and to assert the software correctness, both before the deployment of the final product as well as during its maintenaice.",1.0
30,30,100,what is structural testing,whQuestion,"Structural testing (or White-Box testing) is a technique in which tests are derived from the knowledge of the software's structure or internal implementation. That way, the testing professional is able to check if a specific part of the code is correct. Unit testing is an instance of structural testing.","Structural testing (or White-Box testing) is a technique in which tests are derived from the knowledge of the software's structure or internal implementation. That way, the testing professional is able to check if a specific part of the code is correct. Unit testing is an instance of structural testing.",1.000000238418579
31,31,101,hi,Greet,"Hi there, what do you need?",Hi,0.5008180737495422
32,32,101,what is software testing,whQuestion,"Software testing is an activity of software engineering whose main goal is to validate the project requisites and to assert the software correctness, both before the deployment of the final product as well as during its maintenaice.","Software testing is an activity of software engineering whose main goal is to validate the project requisites and to assert the software correctness, both before the deployment of the final product as well as during its maintenance.",0.9988222718238831
33,33,101,what is your name,whQuestion,"I am TOB-STT, a software testing teaching assistant!","Software testing is an activity of software engineering whose main goal is to validate the project requisites and to assert the software correctness, both before the deployment of the final product as well as during its maintenance.",0.27728745341300964
34,34,101,how can I test my software,Statement,"Sorry, I still can't answer that.. Could you ask me differently?","Sorry, I didn't understand your question, could you repeat?",0.5751727223396301
35,35,101,what can you do for me,whQuestion,You can ask me anything related to testing terminology and usage of software testing criterias,"Sorry, I didn't understand your question, could you repeat?",0.10015181452035904
36,36,101,list for me all testing terminology,Statement,"Sorry, I still can't answer that.. Could you ask me differently?","Sorry, I didn't quite catch that",0.26980283856391907
37,37,101,what is a life cycle,whQuestion,"Sorry, I still can't answer that.. Could you ask me differently?",A cycle is a path that connects the first node to the last. They are usually the loops in CFG.,0.057078585028648376
38,38,101,what do you know,whQuestion,You can ask me anything related to testing terminology and usage of software testing criterias,A cycle is a path that connects the first node to the last. They are usually the loops in CFG.,0.09542055428028107
39,39,101,what is kanban,whQuestion,"Sorry, I still can't answer that.. Could you ask me differently?",A cycle is a path that connects the first node to the last. They are usually the loops in CFG.,0.057078585028648376
40,40,101,what is an unit test,whQuestion,"A test, in software testing, is the act of performing some assurance of both the correctness of a software and its validation of the project requisistes.","A test, in software testing, is the act of performing some assurance of both the correctness of a software and its validation of the project requisistes.",1.0
41,41,101,what is a functional testing,whQuestion,"Functional testing (or Black Box Testing) is a technique whereby the system is tested against the functional requirements/specifications. During the functional testing the internal logic of the system being tested is not known to the tester. Functional testing ensures that the requirements are properly satisfied by the system. This type of testing is not concerned with how processing occurs, but rather, with the results of processing. It simulates actual system usage but does not make any system structure assumptions. Functional testing is normally performed during the levels of System Testing and Acceptance Testing.","Functional testing (or Black Box Testing) is a technique whereby the system is tested against the functional requirements/specifications. During the functional testing the internal logic of the system being tested is not known to the tester. Functional testing ensures that the requirements are properly satisfied by the system. This type of testing is not concerned with how processing occurs, but rather, with the results of processing. It simulates actual system usage but does not make any system structure assumptions. Functional testing is normally performed during the levels of System Testing and Acceptance Testing.",0.9999998807907104
42,42,101,what is acceptance testing,whQuestion,Acceptance testing is a level of software testing where a system is tested for acceptability. The purpose of this test is to evaluate the system’s compliance with the business requirements and assess whether it is acceptable for delivery.,Acceptance testing is a level of software testing where a system is tested for acceptability. The purpose of this test is to evaluate the system’s compliance with the business requirements and assess whether it is acceptable for delivery.,1.0000001192092896
43,43,101,Regression testing,Statement,"Sorry, I still can't answer that.. Could you ask me differently?","Sorry, I didn't quite catch that",0.26980283856391907
44,44,101,Alpha testing,Statement,"Sorry, I still can't answer that.. Could you ask me differently?","Software testing is an activity of software engineering whose main goal is to validate the project requisites and to assert the software correctness, both before the deployment of the final product as well as during its maintenaice.",-0.02424190565943718
45,45,102,Hi,Greet,Welcome!,Hi,0.13563869893550873
46,46,102,What is software testing,whQuestion,"Software testing is an activity of software engineering whose main goal is to validate the project requisites and to assert the software correctness, both before the deployment of the final product as well as during its maintenaice.","Software testing is an activity of software engineering whose main goal is to validate the project requisites and to assert the software correctness, both before the deployment of the final product as well as during its maintenance.",0.9988222718238831
47,47,103,hi,Greet,Welcome!,Hi,0.13563869893550873
48,48,103,Who are you,whQuestion,"I am TOB-STT, a software testing teaching assistant!","Sorry, I didn't understand your question, could you repeat?",0.09302129596471786
49,49,103,what can you do,whQuestion,I am here to help you with software testing. I can answer some question you ask me about that topic.,I don't understand what you mean,0.08567377179861069
50,50,103,what is test4,whQuestion,"Sorry, I still can't answer that.. Could you ask me differently?",I don't understand what you mean,0.32585859298706055
51,51,103,what is test,whQuestion,"A test, in software testing, is the act of performing some assurance of both the correctness of a software and its validation of the project requisistes.","A test, in software testing, is the act of performing some assurance of both the correctness of a software and its validation of the project requisistes.",1.0
52,52,103,teste,Statement,"Sorry, I still can't answer that.. Could you ask me differently?","Sorry, I didn't understand your question, could you repeat?",0.5751727223396301
53,53,103,test,Statement,"Sorry, I still can't answer that.. Could you ask me differently?","A test, in software testing, is the act of performing some assurance of both the correctness of a software and its validation of the project requisistes.",0.03370435908436775
54,54,103,o que é teste,nAnswer,"Sorry, I still can't answer that.. Could you ask me differently?","Sorry, I didn't quite catch that",0.26980283856391907
55,55,103,bye,Bye,See you!,Bye!,0.6012639403343201
56,56,103,see you,Statement,Bye bye!,Bye!,0.8651018142700195
57,57,103,bye bye,Bye,Bye bye!,Bye!,0.8651018142700195
58,58,103,What is a error,whQuestion,An error is a state of execution of the program which is not expected and may lead to an incorrect result.,An error is a state of execution of the program which is not expected and may lead to an incorrect result.,1.0000001192092896
59,59,103,what is a fault,whQuestion,"Fault is an incorrect step, process, or data definition in computer program. Fault is the formal name of a bug.","Fault is an incorrect step, process, or data definition in computer program. Fault is the formal name of a bug. A software defect or bug is a condition in a software product which doesn’t meet a software requirement or end-user expectation.",0.9519746899604797
60,60,103,give a exempla,Statement,"Sorry, I still can't answer that.. Could you ask me differently?","Sorry, I didn't understand your question, could you repeat?",0.5751727223396301
61,61,103,give me a example,Statement,"Sorry, I still can't answer that.. Could you ask me differently?","A defect is an incorrect data definition. In your code, it could be an access of inexistent position in a vector, for instance.",0.09841835498809814
62,62,103,Can you give me a example of equivalence class partitioning criteria,ynQuestion,"Consider the specification. A program validates a field in the following way: values less than 10 are rejected, values between 10 and 21 are accepted and values greater or equal to 22 are rejected. In this problem, the values 3, 10 and 22 cover all the existing equivalence classes.",I don't understand what you mean,0.12363418936729431
63,63,103,waht is software testing,Statement,"Sorry, I still can't answer that.. Could you ask me differently?","Software testing is an activity of software engineering whose main goal is to validate the project requisites and to assert the software correctness, both before the deployment of the final product as well as during its maintenance.",-0.030446060001850128
64,64,103,what is software testing,whQuestion,"Software testing is an activity of software engineering whose main goal is to validate the project requisites and to assert the software correctness, both before the deployment of the final product as well as during its maintenaice.","Software testing is an activity of software engineering whose main goal is to validate the project requisites and to assert the software correctness, both before the deployment of the final product as well as during its maintenance.",0.9988222718238831
65,65,103,fault,Statement,"Sorry, I still can't answer that.. Could you ask me differently?","Fault is an incorrect step, process, or data definition in computer program. Fault is the formal name of a bug. A software defect or bug is a condition in a software product which doesn’t meet a software requirement or end-user expectation.",0.05178535357117653
66,66,103,what is fault,whQuestion,"Fault is an incorrect step, process, or data definition in computer program. Fault is the formal name of a bug.","Fault is an incorrect step, process, or data definition in computer program. Fault is the formal name of a bug. A software defect or bug is a condition in a software product which doesn’t meet a software requirement or end-user expectation.",0.9519746899604797
67,67,103,what is error,whQuestion,An error is a state of execution of the program which is not expected and may lead to an incorrect result.,An error is a state of execution of the program which is not expected and may lead to an incorrect result.,1.0000001192092896
68,68,103,what is Failure,whQuestion,A failure is a result of the program which is incorrect or not expected. This is caused by an error.,A failure is a result of the program which is incorrect or not expected. This is caused by an error.,1.0
69,69,103,what is teste case,whQuestion,"Sorry, I still can't answer that.. Could you ask me differently?",I don't understand what you mean,0.32585859298706055
70,70,103,what is test case,whQuestion,"A test case is composed by the test input, the execution conditions and the expected output to be produced by the program.","A test case is composed by the test input, the execution conditions and the expected output to be produced by the program.",1.0000001192092896
71,71,103,what is teste coverage,whQuestion,"Sorry, I still can't answer that.. Could you ask me differently?",I don't understand what you mean,0.32585859298706055
72,72,103,what is testing coverage,whQuestion,"Sorry, I still can't answer that.. Could you ask me differently?","Sorry, I didn't understand your question, could you repeat?",0.5751727223396301
73,73,103,what is oracle,whQuestion,"An oracle is any human or mechanical agent that decides whether a program behaved correctly in a given test and accordingly results in a verdict of “pass” or “fail.” There exist many different kinds of oracles; for example, unambiguous requirements specifications, behavioral models, and code annotations. Automation of mechanized oracles can be difficult and expensive.","An oracle is any human or mechanical agent that decides whether a program behaved correctly in a given test and accordingly results in a verdict of “pass” or “fail.” There exist many different kinds of oracles; for example, unambiguous requirements specifications, behavioral models, and code annotations. Automation of mechanized oracles can be difficult and expensive.",1.0000001192092896
74,74,103,what id oracle problem,whQuestion,"Sorry, I still can't answer that.. Could you ask me differently?","Sorry, I didn't quite catch that",0.26980283856391907
75,75,103,what is the aim of testing,whQuestion,"Software testing is an activity of software engineering whose main goal is to validate the project requisites and to assert the software correctness, both before the deployment of the final product as well as during its maintenaice.","Software testing is an activity of software engineering whose main goal is to validate the project requisites and to assert the software correctness, both before the deployment of the final product as well as during its maintenaice.",1.0
